pcf_id,ingram_part,description,vendor_name,vendor_part,customer_price,available_qty,category,subcategory,api_status,mayorista,lista,stock_pcf,stock_raw,nombre_pcf,precio_normal,precio_oferta,ficha_vacia,stock_detail,error,solotodo_id,pcf_price,min_price,mode_price,mean_price
38655,100002242,"Zebra ZD510-HC - Impresora de etiquetas - térmica directa - Rollo (3,02 cm) - 300 ppp - hasta 102 mm/segundo - USB 2.0, LAN, host USB",nan,ZD51013-D01E00FZ,419.9,20.0,nan,Physical,ok,True,1,14,14,Rotuladora Etiquetadora de pulseras ZD510-HC,0,0,False,{},,,,,,
42505,100015665,Epson - Receipt printer - Monochrome - Thermal line - USB - TM-T20IIIL-001,nan,C31CH26001,117.7,100.0,nan,Physical,ok,True,1,50,+50,Impresora POS Térmica TM-T20IIIL-001  Serial y USB,0,0,False,{},,,,,,
55823,100017963,Zebra - Funda protectora PDA,nan,SG-TC2L-BOOT-01,46.3,20.0,nan,Physical,ok,True,1,30,+30,Protector para Lector de códigos TC22/ TC27,0,0,False,{},,,,,,
49916,100017075,"HyperX Cloud Stinger 2 - Gaming - auricular - tamaño completo - cableado - conector de 3,5 mm - negro - para Victus by HP Laptop 15, 16; EliteDesk 800 G6; Laptop 17; Pavilion x360 Laptop",nan,519T1AA,37.6,20.0,nan,Physical,ok,True,1,100,+100,"Audífono Gamer HyperX Cloud Stinger 2, Sonido Estéreo, Conexión 3.5mm, Negro",0,0,False,{},,155129,39990,39980,,43374
56169,AC000ASU42,ASUS - ROG RYUO IV SLC 360 ARGB,nan,90RC0151-B0AAY0,360.1,20.0,nan,Physical,ok,True,1,30,+30,Refrigeración Líquida ROG Ryuo IV SLC 360 ARGB,0,0,False,{},,368757,389990,299900,389990,370311
56170,AC000ASU43,ASUS - TUF GAMING LC III 360 ARGB LCD,nan,90RC01A1-B0AAY0,160.9,20.0,nan,Physical,ok,True,1,50,+50,Refrigeración Líquida TUF Gaming LC III 360 ARGB LCD,0,0,False,{},,367158,169990,156900,169990,169918
55040,AN000ASU11,ASUS - Carrying backpack - AP4600 Bag,nan,90XB08L0-BBP050,16.7,20.0,nan,Physical,ok,True,1,100,+100,Mochila AP4600 para Notebook 16“ Gris,0,0,False,{},,,,,,
56090,AN795DEL21,Dell - Docking station - Docking station adapter - WD25 2xDP 1xHDMI 1xUSB-C 4xUSB,nan,DELL-WD25,163.8,20.0,nan,Physical,ok,True,1,100,+100,Docking Pro - WD25,0,0,False,{},,,,,,
56084,100002270,Zebra Impresora de Credenciales ZC300 Dual Sided US Cord USB & Ethernet KIT que Incluye Windows Driver CardStudio 2.0 (Standard) SW de diseño 200 PVC tarjetas YMCKOK ribbon ( para 200 imágene,nan,ZC32-000CQ00LA00,1205.6,4.0,nan,Physical,ok,True,1,8,8,Impresoras de tarjetas ZC300,0,0,False,{},,,,,,
55362,100002627,"ZEBRA ZT411 TT Printer, 203 dpi, US Cord, Serial, USB, 10/100 Ethernet, Bluetooth 4.1/MFi, USB Host, EZPL  ",nan,ZT41142-T010000Z,956.6,20.0,nan,Physical,ok,True,1,100,+100,Impresora de Etiquetas ZT411,0,0,False,{},,,,,,
55822,100016880,"ZEBRA   ZT231 TT Printer ; 4"", 203 dpi, Thermal Transfer, Tear, US Cord, USB, Serial, Ethernet, BTLE, USB Host, EZPL ",nan,ZT23142-T01000FZ,814.8,20.0,nan,Physical,ok,True,1,30,+30,Impresora POS ZT231,0,0,False,{},,,,,,
47955,100017445,"HyperX Cloud Stinger 2 Core - Auricular - tamaño completo - cableado - negro - para Victus by HP Laptop 15, 16; EliteDesk 800 G6; Laptop 17; Pavilion x360 Laptop",nan,683L9AA,32.7,20.0,nan,Physical,ok,True,1,100,+100,"Audífono Gamer HyperX Cloud Stinger Core 2, Sonido Estéreo, Conexión 3.5mm, 2 gen, Negro",0,0,False,{},,193777,34990,27990,34990,34056
56093,100018880,POLY - TC10 Touch Controller,nan,875K5AA,809.3,5.0,nan,Physical,ok,True,1,2,2,Control táctil Poly TC10,0,0,False,{},,,,,,
40843,AB000KNS08,"Kensington High Speed HDMI Cable with Ethernet, 6ft - Alta velocidad - cable HDMI con Ethernet - HDMI macho a HDMI macho - 1.83 m - negro - compatibilidad con 4K",nan,K33020WW,6.2,10.0,nan,Physical,ok,True,1,100,+100,Cable HDMI/HDMI 2.0 de 1.8 metros,0,0,False,{},,,,,,
50265,AB000KNS11,Kensington ClickSafe 2.0 Universal Keyed Laptop Lock - Bloqueo de cable de seguridad - 1.8 m,nan,K68102WW,34.4,20.0,nan,Physical,ok,True,1,12,12,Candado ClickSafe® 2.0 Universal 3 en 1,0,0,False,{},,,,,,
55814,AC000LEN47,Lenovo Mouse Professional Bluetooth Rechargeable,nan,4Y51J62544,24.2,20.0,nan,Physical,ok,True,1,4,4,Mouse Inalámbrico Profesional - Negro,0,0,False,{},,220004,29990,26500,29990,33351
32886,AC002KNS45,Kensington MicroSaver 2.0 Keyed Laptop Lock - Cable de seguridad - plata,nan,K65035AM,18.9,20.0,nan,Physical,ok,True,1,100,+100,"Candado Notebook MicroSaver® 2.0 con llave 1,8mts",0,0,False,{},,,,,,
19959,AC002KNS24,"Kensington Universal - Funda con tapa para tableta - negro - 10""",nan,K97328WW,11.7,20.0,nan,Physical,ok,True,1,50,+50,"Funda Universal Negra para Tablet de 9 y 10""",0,0,False,{},,,,,,
54911,AC002KNS66,Kensington Slim N17 Combination Laptop Lock for Wedge-Shaped Slot - Bloqueo de cable de seguridad,nan,K68008WW,28.0,20.0,nan,Physical,ok,True,1,100,+100,Cable de Seguridad N17 K68008WW,0,0,False,{},,,,,,
52199,AC002KNS88,Kensington Slim NanoSaver 2.0 Keyed Laptop Lock - Bloqueo de cable de seguridad - 1.8 m,nan,K65021WW,22.4,20.0,nan,Physical,ok,True,1,100,+100,Cable de Seguridad NanoSaver™ SLIM para ultrabook 2.0,0,0,False,{},,,,,,
50648,AC004KNS13,"Kensington SmartFit Extra Wide Monitor - Base - para Monitor - madera - tamaño de pantalla: hasta 27""",nan,K52797,24.1,12.0,nan,Physical,ok,True,1,18,18,"Base para Monitor Stand Plus Extra larga SmartFit hasta 27"" ",0,0,False,{},,,,,,
6255,AC008KNS40,KNS Apoya Muñecas para Teclado Foam - Negro,nan,K62383,8.9,4.0,nan,Physical,ok,True,1,100,+100,Apoya muñecas Foam Negro ,0,0,False,{},,,,,,
40938,AC004KNS15,Kensington - Monitor stand,nan,K58300WW,29.3,2.0,nan,Physical,ok,True,1,18,18,"Base para Monitor con organización Space Saving hasta 27""",0,0,False,{},,,,,,
47527,AK014KNS42,Kensington Orbit with Scroll Ring - Bola de seguimiento - diestro y zurdo - óptico - cableado - USB - gris espacio,nan,K75327WW,33.1,7.0,nan,Physical,ok,True,1,4,4,Mouse Trackball Orbit USB  Optical Negro,0,0,False,{},,99886,39990,36698,39990,41817
55826,AN004LEN18,Lenovo - Docking station - Docking station stand - Lenovo Dual Display Dock IT Tr,nan,40B90100IT,82.1,20.0,nan,Physical,ok,True,1,50,+50,Docking station USB-C Dual Display Travel,0,0,False,{},,,,,,
55811,AN004LEN27,Lenovo - Keyboard and mouse pad,nan,4X31S04857,37.6,20.0,nan,Physical,ok,True,1,100,+100,Combo Teclado + Mouse Inalámbrico Multi-Mode Pro 6000 - Negro,0,0,False,{},,368572,45990,41500,,44030
55810,AN004LEN22,Lenovo - Keyboard and mouse pad - Essential Wireless Combo,nan,4X31R64500,24.8,20.0,nan,Physical,ok,True,1,100,+100,Combo Teclado + Mouse Inalámbrico Essential Gen 2 - Negro,0,0,False,{},,358117,32990,26951,,33896
19884,AN012KNS41,"Kensington LS150 - Mochila para transporte de portátil - 15.6"" - negro",nan,K62617WW,22.0,3.0,nan,Physical,ok,True,1,1,1,"Mochila para Notebook Campus 15.6"" - Negro  ",0,0,False,{},,,,,,
52797,AN012KNS66,Kensington - Carrying backpack - 16in - K60392WW,nan,K60392WW,23.9,18.0,nan,Physical,ok,True,1,30,+30,"Mochila para Notebook Ecofriendly EQ 16"" - Negro",0,0,False,{},,,,,,
52799,AN012KNS69,Kensington - Simply Portable Lite Backpack - 16in - Green - Water-resistant ,nan,K60397WW,13.8,6.0,nan,Physical,ok,True,1,20,20,"Mochila para Notebook Simply Portable Waterproof 16"" - Verde",0,0,False,{},,,,,,
52796,AN012KNS67,"Kensington - Mochila de transporte - 14"" - Negro",nan,K60391WW,20.6,5.0,nan,Physical,ok,True,1,50,+50,"Mochila para Notebook Ecofriendly EQ 14"" - Negro",0,0,False,{},,,,,,
25216,AO001BRO19,"Brother LT-6505 - Bandeja/alimentador de papel - 520 hojas - para Brother DCP-L5510, HL-L5210, L5215, L6300, L6400, L6410, MFC-L6710, L6900, L6910, L6970",nan,LT6505,153.8,1.0,nan,Physical,ok,True,1,2,2,Bandeja inferior de 520 hojas LT-6505,0,0,False,{},,,,,,
26241,AP400BRO05,"Brother DK-2251 - Negro/rojo sobre blanco - Rollo (6,2 cm x 15,2 m) 1 bobina(s) cinta de etiqueta - para Brother QL-800, QL-810W, QL-820NW, QL-820NWB",nan,DK2251,18.0,20.0,nan,Physical,ok,True,1,50,+50,"Cinta fondo blanco-Texto rojo/negro DK-2251 62mm / 15,2m (Ancho / Largo) ",0,0,False,{},,,,,,
54591,AO005EPS27,"Epson - Caja de mantenimiento de repuesto - para WorkForce Pro EP-C800, WF-C5390",nan,C12C938211,18.5,20.0,nan,Physical,ok,True,1,22,22,Caja de mantenimiento,0,0,False,{},,,,,,
23136,AR100BRO04,"Brother DK-1209 - Papel - blanco - 28.9 x 62 mm 800 etiquetas de direcciones - para Brother QL-1050, 1060, 1100, 1110, 500, 550, 570, 580, 650, 700, 710, 720, 800, 810, 820",nan,DK1209,13.1,20.0,nan,Physical,ok,True,1,100,+100,Cinta blanca-Texto negro  DK-1209 62mm / 29mm 800 etiquetas (Ancho / Largo),0,0,False,{},,,,,,
42553,AS102EPS92,"Epson T555 - Photo Negro - original - recarga de tinta - para EcoTank L8160, L8180",nan,T555120-AL,18.8,20.0,nan,Physical,ok,True,1,100,+100,Botella de Tinta Original Epson T555120-AL Negro Fotográfico,0,0,False,{},,259455,22990,20248,25990,23893
42555,AS102EPS94,"Epson T555 - Magenta - original - recarga de tinta - para EcoTank L8160, L8180",nan,T555320-AL,18.8,20.0,nan,Physical,ok,True,1,100,+100,Botella de Tinta Original Epson T555320-AL Magenta,0,0,False,{},,259453,23990,20248,24990,23989
42557,AS102EPS96,"Epson T555 - Gris foto - original - recarga de tinta - para EcoTank L8160, L8180",nan,T555520-AL,18.8,20.0,nan,Physical,ok,True,1,50,+50,Botella de Tinta Original Epson T555520-AL Gris,0,0,False,{},,259815,24990,20248,24990,23519
42554,AS102EPS93,"Epson T555 - Cián - original - recarga de tinta - para EcoTank L8160, L8180",nan,T555220-AL,18.8,20.0,nan,Physical,ok,True,1,100,+100,Botella de Tinta Original Epson T555220-AL Cyan,0,0,False,{},,259691,23990,20248,25990,23500
42556,AS102EPS95,"Epson T555 - Amarillo - original - recarga de tinta - para EcoTank L8160, L8180",nan,T555420-AL,18.8,20.0,nan,Physical,ok,True,1,100,+100,Botella de Tinta Original Epson T555420-AL Amarillo,0,0,False,{},,259452,22990,20248,25990,23868
18825,AS102HEW04,"HP 935XL - 9.5 ml - magenta - original - cartucho de tinta - para Officejet 6812, 6815, 6820; Officejet Pro 6230, 6230 ePrinter, 6830, 6835",nan,C2P25AL,24.4,3.0,nan,Physical,ok,True,1,18,18,Cartucho de Tinta Original HP 935 XL Magenta ,0,0,False,{},,259784,29990,25459,,29608
45374,AS103EPS10,Epson - T664520-4 - Ink tank - Color - Pack full set L120 L,nan,T664520-4P,26.7,20.0,nan,Physical,ok,True,1,100,+100,Pack 4 Botellas de Tinta Original Epson T664520-4P Colores,0,0,False,{},,259337,32990,29900,32990,32597
49671,AS103EPS32,"Epson SJIC41P-BK - Negro brillante - original - blíster con alarmas de RF/acústica - cartucho de tinta - para ColorWorks CW-C4000, CW-C4000E (BK)",nan,C13T52L120,25.6,8.0,nan,Physical,ok,True,1,4,4,Cartucho de Tinta Origina Epson SJIC41P-BK Negro,0,0,False,{},,259813,32990,27527,32990,30772
49673,AS103EPS35,"Epson SJIC41P-M - Magenta - original - blíster con alarmas de RF/acústica - cartucho de tinta - para ColorWorks CW-C4000, CW-C4000E (BK), CW-C4000E (MK)",nan,C13T52L320,25.6,4.0,nan,Physical,ok,True,1,4,4,Cartucho de Tinta Origina Epson SJIC41P-M Magenta,0,0,False,{},,259310,32990,27527,32990,30332
49672,AS103EPS34,"Epson SJIC41P-C - Cián - original - blíster con alarmas de RF/acústica - cartucho de tinta - para ColorWorks CW-C4000, CW-C4000E (BK), CW-C4000E (MK)",nan,C13T52L220,25.6,4.0,nan,Physical,ok,True,1,6,6,Cartucho de Tinta Origina Epson SJIC41P-C Cyan,0,0,False,{},,259311,32990,27527,32990,30332
25231,AS151BRO54,"Brother LC3017BK XL - Alto rendimiento - negro - original - cartucho de tinta - para Brother MFC-J5330DW, MFC-J6530DW; Business Smart Pro MFC-J6930DW",nan,LC3017BK,17.8,20.0,nan,Physical,ok,True,1,23,23,Cartucho de Tinta Original Brother LC3017 Negro,0,0,False,{},,259629,22990,14290,,22147
22632,AS151BRO39,"Brother DR3460 - Original - kit de tambor - para Brother DCP-L5650DN, HL-L6200DW, HL-L6200DWT, MFC-L5800DW, MFC-L5900DW, MFC-L6900DW",nan,DR3460,134.6,20.0,nan,Physical,ok,True,1,100,+100,Tambor original Brother DR-3460,0,0,False,{},,,,,,
25235,AS151BRO58,"Brother LC3019BK XXL - Súper Alto Rendimiento - negro - original - cartucho de tinta - para Brother MFC-J5330DW, MFC-J6530DW; Business Smart Pro MFC-J6930DW",nan,LC3019BK,31.4,19.0,nan,Physical,ok,True,1,50,+50,Cartucho de Tinta Original Brother  LC3019 Negro,0,0,False,{},,266704,,,,
25233,AS151BRO56,"Brother LC3017M - XL - magenta - original - cartucho de tinta - para Brother MFC-J5330DW, MFC-J6530DW; Business Smart Pro MFC-J6930DW",nan,LC3017M,12.0,20.0,nan,Physical,ok,True,1,50,+50,Cartucho de Tinta Original Brother LC3017 Magenta,0,0,False,{},,259628,15990,12895,14990,15166
25236,AS151BRO59,"Brother LC3019C - Tamaño XXL - cián - original - cartucho de tinta - para Brother MFC-J5330DW, MFC-J6530DW, MFC-J6730DW; Business Smart Pro MFC-J6930DW",nan,LC3019C,19.5,19.0,nan,Physical,ok,True,1,50,+50,Cartucho de Tinta Original Brother  LC3019 Cyan,0,0,False,{},,266704,,,,
25237,AS151BRO60,"Brother LC3019M - Tamaño XXL - magenta - original - cartucho de tinta - para Brother MFC-J5330DW, MFC-J6530DW, MFC-J6730DW; Business Smart Pro MFC-J6930DW",nan,LC3019M,19.6,12.0,nan,Physical,ok,True,1,50,+50,Cartucho de Tinta Original Brother  LC3019 Magenta,0,0,False,{},,266704,,,,
25238,AS151BRO61,"Brother LC3019Y - Tamaño XXL - amarillo - original - cartucho de tinta - para Brother MFC-J5330DW, MFC-J6530DW, MFC-J6730DW; Business Smart Pro MFC-J6930DW",nan,LC3019Y,19.6,20.0,nan,Physical,ok,True,1,25,25,Cartucho de Tinta Original Brother  LC3019 Amarillo,0,0,False,{},,266704,,,,
35533,AS151BRO62,"Brother DR411CL - Original - kit de tambor - para Brother HL-L8360CDW, MFC-L8900CDW",nan,DR411CL,137.7,3.0,nan,Physical,ok,True,1,10,10,Tambor original Brother DR-411,0,0,False,{},,,,,,
45888,AS151BRO90,"Brother LC402XLBK - Alto rendimiento - negro - original - caja para colgar - cartucho de tinta - para Brother MFC-J5340DW, MFC-J6540DW, MFC-J6940DW",nan,LC402XLBKS,36.7,20.0,nan,Physical,ok,True,1,100,+100,Cartucho de Tinta Original Brother LC402XLBKS Negro,0,0,False,{},,259334,44990,40645,44990,45274
45884,AS151BRO93,"Brother LC402BK - Negro - original - cartucho de tinta - para Brother MFC-J5340DW, MFC-J6540DW, MFC-J6940DW",nan,LC402BKS,17.9,20.0,nan,Physical,ok,True,1,100,+100,Cartucho de Tinta Original Brother LC402BKS Negro,0,0,False,{},,259706,21990,19492,25990,23188
13207,AS204EPS07,"Epson T673 - Amarillo - original - recarga de tinta - para Epson L1800, L800, L805, L810, L850; EcoTank L1800",nan,T673420-AL,11.2,20.0,nan,Physical,ok,True,1,50,+50,Botella de Tinta Original Epson T673420-AL Amarillo ,0,0,False,{},,259580,13990,12023,16990,14525
13204,AS204EPS09,"Epson T673 - Magenta claro - original - recarga de tinta - para Epson L1800, L800, L805, L810, L850; EcoTank L1800",nan,T673620-AL,11.2,20.0,nan,Physical,ok,True,1,100,+100,Botella de Tinta Original Epson T673620-AL Magenta Claro ,0,0,False,{},,259582,13990,12023,16990,14494
13205,AS204EPS08,"Epson T673 - Cián claro - original - recarga de tinta - para Epson L1800, L800, L805, L810, L850; EcoTank L1800",nan,T673520-AL,11.2,20.0,nan,Physical,ok,True,1,100,+100,Botella de Tinta Original Epson  T673520-AL Cyan Claro,0,0,False,{},,259581,14990,9990,16990,14465
17308,AS205EPS01,"Epson T7741 - 140 ml - negro - original - recarga de tinta - para Epson L1455, L605, L655, M100; EcoTank ET-4550, L1455, L606; WorkForce ET-16500, ET-4550",nan,T774120-AL,17.6,20.0,nan,Physical,ok,True,1,50,+50,Botella de Tinta Original Epson T774120-AL Negro,0,0,False,{},,261560,20990,19098,24990,22042
12949,AS206EPS25,"Epson T664 - 70 ml - negro - recarga de tinta - para Epson L110, L200, L310, L380, L395, L495, L575, L606, L655, L656, L1300, L1455 ",nan,T664120-AL,7.1,20.0,nan,Physical,ok,True,1,100,+100,Botella de Tinta Original Epson T664120-AL Negro,0,0,False,{},,259506,8990,7662,9990,9377
12951,AS206EPS26,"Epson T664 - Cián - original - recarga de tinta - para Epson L380, L386, L395, L495; EcoTank ET-2600, 2650, L1455, L396, L606, L656",nan,T664220-AL,7.1,20.0,nan,Physical,ok,True,1,100,+100,Botella de Tinta Original Epson T664220-AL Cyan ,0,0,False,{},,259504,8990,7662,9990,9228
12952,AS206EPS27,"Epson T664 - Magenta - original - cartucho de tinta - para Epson L380, L386, L395, L495; EcoTank ET-2600, 2650, L1455, L396, L606, L656",nan,T664320-AL,7.1,20.0,nan,Physical,ok,True,1,100,+100,Botella de Tinta Original Epson T664320-AL Magenta ,0,0,False,{},,259505,8990,6990,9990,9153
12956,AS206EPS28,"Epson T664 - Amarillo - original - recarga de tinta - para Epson L380, L386, L395, L495; EcoTank ET-2600, 2650, L1455, L396, L606, L656",nan,T664420-AL,7.1,20.0,nan,Physical,ok,True,1,100,+100,Botella de Tinta Original Epson T664420-AL Amarillo ,0,0,False,{},,259502,8990,5990,9990,9262
32649,AS207EPS31,"Epson 748XXL - XL - cián - original - blíster con alarmas de RF/acústica - cartucho de tinta - para WorkForce Pro WF-6090, WF-6590, WF-8090, WF-8090 D3TWC, WF-8590, WF-8590 D3TWFC",nan,T748XXL220-AL,59.7,20.0,nan,Physical,ok,True,1,100,+100,Cartucho de Tinta Original Epson T748XXL220-AL Cyan,0,0,False,{},,259881,72990,62780,72990,71148
34019,AS208EPS23,Epson - Ink cartridge - Black - T941120-AL ,nan,T941120-AL,28.5,20.0,nan,Physical,ok,True,1,100,+100,Bolsa-Tinta Negra T941,0,0,False,{},,259690,37990,29995,,36867
34020,AS208EPS24,Epson - Ink cartridge - Cyan - T941220-AL,nan,T941220-AL,43.7,20.0,nan,Physical,ok,True,1,100,+100,Bolsa-Tinta Cyan T941,0,0,False,{},,259689,53990,47090,53990,54542
34021,AS208EPS26,Epson - Ink cartridge - Magenta - T941320-AL,nan,T941320-AL,43.7,20.0,nan,Physical,ok,True,1,100,+100,Bolsa-Tinta Magenta T941,0,0,False,{},,259811,53990,47290,53990,54587
34022,AS208EPS27,Epson - Ink cartridge - Yellow - T941420-AL,nan,T941420-AL,43.7,20.0,nan,Physical,ok,True,1,100,+100,Bolsa-Tinta Amarillo T941,0,0,False,{},,259687,53990,47090,53990,53886
33411,AS208EPS53,"Epson T40W - 80 ml - gran capacidad - negro - original - blíster con alarmas de RF/acústica - cartucho de tinta - para SureColor T2170, T3170, T3170M, T5170, T5170M",nan,T40W120,50.1,20.0,nan,Physical,ok,True,1,50,+50,Tintas-Cartridge T40W120 Negro / 80ml,0,0,False,{},,259940,69990,54718,,60571
33414,AS208EPS56,"Epson T40W - 50 ml - gran capacidad - amarillo - original - blíster con alarmas de RF/acústica - cartucho de tinta - para SureColor T2170, T3170, T3170M, T5170, T5170M",nan,T40W420,36.3,20.0,nan,Physical,ok,True,1,50,+50,Cartucho de Tinta Original Epson T40W420 Amarillo / 50ml,0,0,False,{},,259941,49990,39550,49990,46604
36564,AS209EPS13,Epson - 206 - Ink cartridge - Yellow,nan,T206420-AL,12.7,20.0,nan,Physical,ok,True,1,28,28,Cartucho de Tinta Original Epson T206420-AL Amarillo,0,0,False,{},,259576,15990,13638,16990,15987
34153,AS209EPS04,"Epson - T534120-AL - 6,000 pag - Original - Negro - para Epson M1000, M1120, M1180, M2120, M2140, M2170, M3170, M3180",nan,T534120-AL,14.0,20.0,nan,Physical,ok,True,1,100,+100,Botella de Tinta Original Epson T534120-AL Negro,0,0,False,{},,259584,16990,15020,19990,18190
36562,AS209EPS15,Epson - 206 - Ink cartridge - Cyan,nan,T206220-AL,12.6,20.0,nan,Physical,ok,True,1,12,12,Cartucho de Tinta Original Epson T206220-AL Cyan,0,0,False,{},,259574,15990,14500,,16022
49682,AS209EPS43,Epson - T574220 - Ink refill - Cyan,nan,T574220-AL,8.7,20.0,nan,Physical,ok,True,1,100,+100,Botella de Tinta Original Epson T574220-AL Cyan,0,0,False,{},,259307,10990,9394,11990,11495
49684,AS209EPS45,Epson - T574420 - Ink refill - Yellow,nan,T574420-AL,8.7,20.0,nan,Physical,ok,True,1,100,+100,Botella de Tinta Original Epson T574420-AL Amarillo,0,0,False,{},,259305,10990,9394,13990,11762
49683,AS209EPS44,Epson - T574320 - Ink refill - Magenta,nan,T574320-AL,8.7,20.0,nan,Physical,ok,True,1,100,+100,Botella de Tinta Original Epson T574320-AL Magenta,0,0,False,{},,259306,10990,9394,13990,11560
49685,AS209EPS46,Epson - T574520 - Ink refill - Yellow / Light cyan,nan,T574520-AL,8.7,20.0,nan,Physical,ok,True,1,100,+100,Botella de Tinta Original Epson T574520-AL Cyan Claro,0,0,False,{},,259304,10990,10300,13990,12155
9008,AS217HEW57,"HP 122 - 1.5 ml - amarillo, cián, magenta - original - cartucho de tinta - para Deskjet 1000 J110, 10XX J410, 2050 J510, 2050A J510, 2054A J510, Ink Advantage 2060 K110",nan,CH562HL,17.4,20.0,nan,Physical,ok,True,1,50,+50,Cartucho de Tinta Original HP 122 Tricolor ,0,0,False,{},,259568,20990,18523,23990,21170
10595,AS220HEW01,"HP 950 - 24 ml - negro - original - cartucho de tinta - para Officejet Pro 251dw, 276dw, 8100, 8600, 8610, 8620, 8630",nan,CN049AL,35.3,20.0,nan,Physical,ok,True,1,50,+50,Cartucho de Tinta Original HP 950 Negro ,0,0,False,{},,259478,42990,38450,44990,43177
10599,AS220HEW03,"HP 951 - 8 ml - magenta - original - cartucho de tinta - para Officejet Pro 251, 276, 8100, 8600, 8600 N911, 8610, 8615, 8616, 8620, 8625, 8630, 8640",nan,CN051AL,24.8,20.0,nan,Physical,ok,True,1,50,+50,Cartucho de Tinta Original HP 951 Magenta ,0,0,False,{},,259494,32990,23990,,29793
10597,AS220HEW02,"HP 951 - 8 ml - cián - original - cartucho de tinta - para Officejet Pro 251dw, 276dw, 8100, 8600, 8600 N911a, 8610, 8615, 8616, 8620, 8625, 8630",nan,CN050AL,25.0,15.0,nan,Physical,ok,True,1,29,29,Cartucho de Tinta Original HP 951 Cyan ,0,0,False,{},,259495,32990,24140,30990,29944
32855,AS220HEW05,"HP 951XL - 24 ml - Alto rendimiento - cián - original - cartucho de tinta - para Officejet Pro 251dw, 276dw, 8100, 8600, 8600 N911a, 8610, 8615, 8620, 8625, 8630",nan,CN046AL,41.6,20.0,nan,Physical,ok,True,1,30,+30,Cartucho de Tinta Original HP 951XL Cyan ,0,0,False,{},,259483,49990,45049,52990,49440
10600,AS220HEW04,"HP 951 - 8 ml - amarillo - original - cartucho de tinta - para Officejet Pro 251, 276, 8100, 8600, 8600 N911, 8610, 8615, 8616, 8620, 8625, 8630, 8640",nan,CN052AL,25.1,10.0,nan,Physical,ok,True,1,30,+30,Cartucho de Tinta Original HP 951 Amarillo ,0,0,False,{},,259491,32990,26490,31990,30045
32854,AS220HEW08,"HP 950XL - 53 ml - Alto rendimiento - negro - original - cartucho de tinta - para Officejet Pro 251dw, 276dw, 8100, 8600, 8610, 8620, 8630",nan,CN045AL,60.0,20.0,nan,Physical,ok,True,1,10,10,Cartucho de Tinta Original HP 950 XL Negro ,0,0,False,{},,259487,76990,64390,77990,70857
32857,AS220HEW06,"HP 951XL - 17 ml - Alto rendimiento - magenta - original - cartucho de tinta - para Officejet Pro 251, 276, 8100, 8600, 8600 N911, 8610, 8615, 8616, 8620, 8625, 8630, 8640",nan,CN047AL,41.5,20.0,nan,Physical,ok,True,1,29,29,Cartucho de Tinta Original HP 951XL Magenta ,0,0,False,{},,259485,49990,44500,,48435
32856,AS220HEW07,"HP 951XL - 17 ml - Alto rendimiento - amarillo - original - cartucho de tinta - para Officejet Pro 251dw, 276dw, 8100, 8600, 8600 N911a, 8610, 8615, 8620, 8625, 8630",nan,CN048AL,41.6,20.0,nan,Physical,ok,True,1,30,+30,Cartucho de Tinta Original HP 951XL Amarillo ,0,0,False,{},,259482,49990,29995,52990,47173
11936,AS220HEW13,"HP 670 - 14 ml - negro - original - Ink Advantage - cartucho de tinta - para Deskjet Ink Advantage 3525, Ink Advantage 46XX, Ink Advantage 5525, Ink Advantage 6525",nan,CZ113AL,11.7,20.0,nan,Physical,ok,True,1,30,+30,Cartucho de Tinta Original HP 670 Negro ,0,0,False,{},,260020,14990,13328,14990,14745
21093,AS220HEW57,HP - Ink cartridge - Black - 664XL,nan,F6V31AL,32.8,20.0,nan,Physical,ok,True,1,100,+100,Cartucho de Tinta Original HP 664 XL Negro ,0,0,False,{},,259566,42990,35444,41990,40344
34075,AS221HEW86,HP - 964 - Ink cartridge - Black,nan,3JA53AL,34.7,20.0,nan,Physical,ok,True,1,30,+30,Cartucho de Tinta Original HP 964 Negro ,0,0,False,{},,259484,46990,38900,46990,42867
34081,AS221HEW88,HP - 964XL - Ink cartridge - Magenta,nan,3JA55AL,42.1,20.0,nan,Physical,ok,True,1,30,+30,Cartucho de Tinta Original HP 964 XL Magenta ,0,0,False,{},,259549,55990,46500,59990,51155
40532,AS222HEW14,HP - 667XL - Ink cartridge - Black - 3YM81AL,nan,3YM81AL,32.8,20.0,nan,Physical,ok,True,1,100,+100,Cartucho de Tinta Original HP  667 XL Negro,0,0,False,{},,259777,39990,34995,45990,40455
40530,AS222HEW12,HP - 667 - Ink cartridge - Black - 3YM79AL,nan,3YM79AL,10.4,20.0,nan,Physical,ok,True,1,100,+100,Cartucho de Tinta Original HP  667 Negro,0,0,False,{},,260091,,29990,29990,31487
16631,AT101HEW18,"HP 83A - Negro - original - LaserJet - cartucho de tóner (CF283A) - para LaserJet Pro M201, M202, MFP M125, MFP M127, MFP M225",nan,CF283A,77.1,20.0,nan,Physical,ok,True,1,100,+100,Toner Original HP 83A LaserJet Negro  ,0,0,False,{},,259631,99990,68990,,88368
32858,AT100HEW02,"HP 26A - Negro - original - LaserJet - cartucho de tóner (CF226A) - para LaserJet Pro M402, MFP M426",nan,CF226A,154.0,20.0,nan,Physical,ok,True,1,30,+30,Toner Original HP 26A LaserJet Negro,0,0,False,{},,259615,169990,129900,155990,149948
33805,AT100BRO40,"Brother TN316C - Alto rendimiento - cián - original - cartucho de tóner - para Brother DCP-L8400CDN, HL-L8350CDW, HL-L8350CDWT, MFC-L8600CDW, MFC-L8850CDW",nan,TN316C,96.8,1.0,nan,Physical,ok,True,1,3,3,Toner Original Brother TN-316 Cyan,0,0,False,{},,259733,129990,108182,,119905
22635,AT151BRO41,"Brother TN3479 - Súper Alto Rendimiento - original - cartucho de tóner - para Brother DCP-L5650, HL-L5100, HL-L6400, MFC-L5900, MFC-L6700",nan,TN3479,118.6,20.0,nan,Physical,ok,True,1,100,+100,Toner Original Brother TN-3479 Negro,0,0,False,{},,259537,149990,127500,,145107
32719,AT151BRO42,"Brother TN3499 - Ultra High Yield - original - cartucho de tóner - para Brother HL-L6400DW, HL-L6400DWT, HL-L6400DWTT, MFC-L6900DW, MFC-L6900DWT",nan,TN3499,152.9,10.0,nan,Physical,ok,True,1,30,+30,Toner Original Brother TN-3499 Negro,0,0,False,{},,259667,184990,159900,,178896
33809,AT151BRO64,Brother TN - TN411C - Toner cartridge - Cyan,nan,TN411C,57.7,20.0,nan,Physical,ok,True,1,30,+30,Toner Original Brother TN-411 Cyan,0,0,False,{},,259736,69990,62000,,68560
33808,AT151BRO63,Brother TN - TN411BK - Toner cartridge - Black,nan,TN411BK,51.7,20.0,nan,Physical,ok,True,1,30,+30,Toner Original Brother TN-411 Negro,0,0,False,{},,259617,70990,55752,,63387
33810,AT151BRO65,Brother TN - TN411M - Toner cartridge - Magenta,nan,TN411M,57.7,20.0,nan,Physical,ok,True,1,19,19,Toner Original Brother TN-411 Magenta,0,0,False,{},,259737,69990,62000,,68504
