pcf_id,ingram_part,description,vendor_name,vendor_part,customer_price,available_qty,category,subcategory,api_status,mayorista,lista,stock_pcf,stock_raw,nombre_pcf,precio_normal,precio_oferta,ficha_vacia,stock_detail,error,solotodo_id,pcf_price,min_price,mode_price,mean_price
38655,100002242,"Zebra ZD510-HC - Impresora de etiquetas - térmica directa - Rollo (3,02 cm) - 300 ppp - hasta 102 mm/segundo - USB 2.0, LAN, host USB",nan,ZD51013-D01E00FZ,419.9,20.0,nan,Physical,ok,True,1,9,9,Rotuladora Etiquetadora de pulseras ZD510-HC,0,0,False,{},,,,,,
55823,100017963,Zebra - Funda protectora PDA,nan,SG-TC2L-BOOT-01,46.3,20.0,nan,Physical,ok,True,1,24,24,Protector para Lector de códigos TC22/ TC27,0,0,False,{},,,,,,
56169,AC000ASU42,ASUS - ROG RYUO IV SLC 360 ARGB,nan,90RC0151-B0AAY0,360.1,20.0,nan,Physical,ok,True,1,8,8,Refrigeración Líquida ROG Ryuo IV SLC 360 ARGB,0,0,False,{},,368757,369990,338900,,369046
56170,AC000ASU43,ASUS - TUF GAMING LC III 360 ARGB LCD,nan,90RC01A1-B0AAY0,160.9,20.0,nan,Physical,ok,True,1,50,+50,Refrigeración Líquida TUF Gaming LC III 360 ARGB LCD,0,0,False,{},,367158,169990,153990,169990,167022
55040,AN000ASU11,ASUS - Carrying backpack - AP4600 Bag,nan,90XB08L0-BBP050,16.7,20.0,nan,Physical,ok,True,1,100,+100,Mochila AP4600 para Notebook 16“ Gris,0,0,False,{},,,,,,
20552,AS151BRO28,"Brother BT6001BK - Súper Alto Rendimiento - negro - original - recarga de tinta - para Brother DCP-T300, MFC-T800W",nan,BT6001BK,7.8,20.0,nan,Physical,ok,True,1,100,+100,Botella de Tinta Original Brother BT6001BK Negro,0,0,False,{},,259748,9990,8397,9990,10476
56090,AN795DEL21,Dell - Docking station - Docking station adapter - WD25 2xDP 1xHDMI 1xUSB-C 4xUSB,nan,DELL-WD25,163.8,20.0,nan,Physical,ok,True,1,100,+100,Docking Pro - WD25,0,0,False,{},,,,,,
45885,AS151BRO92,"Brother LC402C - Cián - original - cartucho de tinta - para Brother MFC-J5340DW, MFC-J6540DW, MFC-J6940DW",nan,LC402CS,15.9,20.0,nan,Physical,ok,True,1,100,+100,Cartucho de Tinta Original Brother LC402CS Cyan,0,0,False,{},,259707,19990,17240,,20170
55825,100002551,"ZEBRA ZD230 Thermal Transfer Printer (74/300M); Standard EZPL, 203 dpi, US Power Cord, USB, Ethernet",nan,ZD23042-301C00EZ,281.2,20.0,nan,Physical,ok,True,1,100,+100,Impresora POS ZD230,0,0,False,{},,,,,,
55365,100002614,Zebra DS9308SR BLK 2D USB KIT DS9308SR00004ZZWW ALAMBRICO,nan,DS9308-SR4U2100AZW,133.7,14.0,nan,Physical,ok,True,1,27,27,Lector de Barra DS9308,0,0,False,{},,,,,,
55364,100015605,ZEBRA ZD421Thermal Transfer Printer (74/300M)  203 dpi USB USB Host Modular Connectivity Slot BTLE5 US Cord Swiss Font EZPL,nan,ZD4A042-301M00EZ,319.5,20.0,nan,Physical,ok,True,1,30,+30,Impresora de Etiquetas ZD421,0,0,False,{},,,,,,
55362,100002627,"ZEBRA ZT411 TT Printer, 203 dpi, US Cord, Serial, USB, 10/100 Ethernet, Bluetooth 4.1/MFi, USB Host, EZPL  ",nan,ZT41142-T010000Z,956.6,20.0,nan,Physical,ok,True,1,50,+50,Impresora de Etiquetas ZT411,0,0,False,{},,,,,,
56087,100015642,"ZEBRA  ZD421 Thermal Transfer Printer (74/300M); 203 dpi, USB, USB Host, Ethernet, BTLE5, US Cord, Swiss Font, EZPL",nan,ZD4A042-301E00EZ,344.9,20.0,nan,Physical,ok,True,1,50,+50,Impresora POS ZD421,0,0,False,{},,,,,,
55822,100016880,"ZEBRA   ZT231 TT Printer ; 4"", 203 dpi, Thermal Transfer, Tear, US Cord, USB, Serial, Ethernet, BTLE, USB Host, EZPL ",nan,ZT23142-T01000FZ,814.8,20.0,nan,Physical,ok,True,1,25,25,Impresora POS ZT231,0,0,False,{},,,,,,
47955,100017445,"HyperX Cloud Stinger 2 Core - Auricular - tamaño completo - cableado - negro - para Victus by HP Laptop 15, 16; EliteDesk 800 G6; Laptop 17; Pavilion x360 Laptop",nan,683L9AA,32.7,20.0,nan,Physical,ok,True,1,2,2,"Audífono Gamer HyperX Cloud Stinger Core 2, Sonido Estéreo, Conexión 3.5mm, 2 gen, Negro",0,0,False,{},,193777,34990,27990,34990,33232
56093,100018880,POLY - TC10 Touch Controller,nan,875K5AA,809.3,5.0,nan,Physical,ok,True,1,2,2,Control táctil Poly TC10,0,0,False,{},,,,,,
55814,AC000LEN47,Lenovo Mouse Professional Bluetooth Rechargeable,nan,4Y51J62544,24.2,20.0,nan,Physical,ok,True,1,1,1,Mouse Inalámbrico Profesional - Negro,0,0,False,{},,220004,29990,22900,,32011
19959,AC002KNS24,"Kensington Universal - Funda con tapa para tableta - negro - 10""",nan,K97328WW,11.7,20.0,nan,Physical,ok,True,1,50,+50,"Funda Universal Negra para Tablet de 9 y 10""",0,0,False,{},,,,,,
54911,AC002KNS66,Kensington Slim N17 Combination Laptop Lock for Wedge-Shaped Slot - Bloqueo de cable de seguridad,nan,K68008WW,28.0,20.0,nan,Physical,ok,True,1,100,+100,Cable de Seguridad N17 K68008WW,0,0,False,{},,,,,,
52199,AC002KNS88,Kensington Slim NanoSaver 2.0 Keyed Laptop Lock - Bloqueo de cable de seguridad - 1.8 m,nan,K65021WW,22.4,20.0,nan,Physical,ok,True,1,50,+50,Cable de Seguridad NanoSaver™ SLIM para ultrabook 2.0,0,0,False,{},,,,,,
52200,AC002KNS89,Kensington Slim NanoSaver 2.0 Portable Keyed Laptop Lock - Bloqueo de cable de seguridad - 1.8 m,nan,K65025WW,24.1,20.0,nan,Physical,ok,True,1,14,14,Cable de Seguridad NanoSaver™ SLIM portátil para ultrabook 2.0,0,0,False,{},,,,,,
50648,AC004KNS13,"Kensington SmartFit Extra Wide Monitor - Base - para Monitor - madera - tamaño de pantalla: hasta 27""",nan,K52797,24.1,12.0,nan,Physical,ok,True,1,2,2,"Base para Monitor Stand Plus Extra larga SmartFit hasta 27"" ",0,0,False,{},,,,,,
40938,AC004KNS15,Kensington - Monitor stand,nan,K58300WW,29.3,2.0,nan,Physical,ok,True,1,15,15,"Base para Monitor con organización Space Saving hasta 27""",0,0,False,{},,,,,,
6255,AC008KNS40,KNS Apoya Muñecas para Teclado Foam - Negro,nan,K62383,8.9,4.0,nan,Physical,ok,True,1,100,+100,Apoya muñecas Foam Negro ,0,0,False,{},,,,,,
40840,AN002KNS32,Kensington CA1100E USB-C to Ethernet Adapter - Adaptador de red - USB-C 3.1 - Gigabit Ethernet x 1,nan,K33475WW,17.2,20.0,nan,Physical,ok,True,1,30,+30,Adaptador USB-C a Ethernet (RJ45),0,0,False,{},,382321,22990,20243,,21291
55826,AN004LEN18,Lenovo - Docking station - Docking station stand - Lenovo Dual Display Dock IT Tr,nan,40B90100IT,82.1,20.0,nan,Physical,ok,True,1,28,28,Docking station USB-C Dual Display Travel,0,0,False,{},,,,,,
55811,AN004LEN27,Lenovo - Keyboard and mouse pad,nan,4X31S04857,37.6,20.0,nan,Physical,ok,True,1,100,+100,Combo Teclado + Mouse Inalámbrico Multi-Mode Pro 6000 - Negro,0,0,False,{},,368572,45990,36500,,40937
52797,AN012KNS66,Kensington - Carrying backpack - 16in - K60392WW,nan,K60392WW,23.9,18.0,nan,Physical,ok,True,1,16,16,"Mochila para Notebook Ecofriendly EQ 16"" - Negro",0,0,False,{},,,,,,
52796,AN012KNS67,"Kensington - Mochila de transporte - 14"" - Negro",nan,K60391WW,20.6,5.0,nan,Physical,ok,True,1,10,10,"Mochila para Notebook Ecofriendly EQ 14"" - Negro",0,0,False,{},,,,,,
23136,AR100BRO04,"Brother DK-1209 - Papel - blanco - 28.9 x 62 mm 800 etiquetas de direcciones - para Brother QL-1050, 1060, 1100, 1110, 500, 550, 570, 580, 650, 700, 710, 720, 800, 810, 820",nan,DK1209,13.1,20.0,nan,Physical,ok,True,1,100,+100,Cinta blanca-Texto negro  DK-1209 62mm / 29mm 800 etiquetas (Ancho / Largo),0,0,False,{},,,,,,
26241,AP400BRO05,"Brother DK-2251 - Negro/rojo sobre blanco - Rollo (6,2 cm x 15,2 m) 1 bobina(s) cinta de etiqueta - para Brother QL-800, QL-810W, QL-820NW, QL-820NWB",nan,DK2251,18.0,20.0,nan,Physical,ok,True,1,30,+30,"Cinta fondo blanco-Texto rojo/negro DK-2251 62mm / 15,2m (Ancho / Largo) ",0,0,False,{},,,,,,
27246,AR100BRO05,"Brother - Rollo (1,2 cm x 8 m) cinta no laminada - para Brother PT-45; P-Touch PT-100, 110, 45, 55, 65, 70, 80, 85, 90, M95",nan,M231,7.5,20.0,nan,Physical,ok,True,1,100,+100,Cinta blanca-Texto negro M-231 12mm / 8mm (Ancho / Largo) ,0,0,False,{},,250997,,,,
42553,AS102EPS92,"Epson T555 - Photo Negro - original - recarga de tinta - para EcoTank L8160, L8180",nan,T555120-AL,18.8,20.0,nan,Physical,ok,True,1,100,+100,Botella de Tinta Original Epson T555120-AL Negro Fotográfico,0,0,False,{},,259455,22990,20243,25990,24249
42555,AS102EPS94,"Epson T555 - Magenta - original - recarga de tinta - para EcoTank L8160, L8180",nan,T555320-AL,18.8,20.0,nan,Physical,ok,True,1,100,+100,Botella de Tinta Original Epson T555320-AL Magenta,0,0,False,{},,259453,23990,20243,23990,23832
42554,AS102EPS93,"Epson T555 - Cián - original - recarga de tinta - para EcoTank L8160, L8180",nan,T555220-AL,18.8,20.0,nan,Physical,ok,True,1,100,+100,Botella de Tinta Original Epson T555220-AL Cyan,0,0,False,{},,259691,23990,20243,23990,23864
42556,AS102EPS95,"Epson T555 - Amarillo - original - recarga de tinta - para EcoTank L8160, L8180",nan,T555420-AL,18.8,20.0,nan,Physical,ok,True,1,100,+100,Botella de Tinta Original Epson T555420-AL Amarillo,0,0,False,{},,259452,22990,20243,27990,24107
42557,AS102EPS96,"Epson T555 - Gris foto - original - recarga de tinta - para EcoTank L8160, L8180",nan,T555520-AL,18.8,20.0,nan,Physical,ok,True,1,100,+100,Botella de Tinta Original Epson T555520-AL Gris,0,0,False,{},,259815,24990,20243,28490,24152
18825,AS102HEW04,"HP 935XL - 9.5 ml - magenta - original - cartucho de tinta - para Officejet 6812, 6815, 6820; Officejet Pro 6230, 6230 ePrinter, 6830, 6835",nan,C2P25AL,24.4,3.0,nan,Physical,ok,True,1,18,18,Cartucho de Tinta Original HP 935 XL Magenta ,0,0,False,{},,259784,29990,24922,,29230
45374,AS103EPS10,Epson - T664520-4 - Ink tank - Color - Pack full set L120 L,nan,T664520-4P,26.7,20.0,nan,Physical,ok,True,1,100,+100,Pack 4 Botellas de Tinta Original Epson T664520-4P Colores,0,0,False,{},,259337,32990,29900,32990,32811
49672,AS103EPS34,"Epson SJIC41P-C - Cián - original - blíster con alarmas de RF/acústica - cartucho de tinta - para ColorWorks CW-C4000, CW-C4000E (BK), CW-C4000E (MK)",nan,C13T52L220,25.6,4.0,nan,Physical,ok,True,1,6,6,Cartucho de Tinta Origina Epson SJIC41P-C Cyan,0,0,False,{},,259311,32990,27523,,30141
49673,AS103EPS35,"Epson SJIC41P-M - Magenta - original - blíster con alarmas de RF/acústica - cartucho de tinta - para ColorWorks CW-C4000, CW-C4000E (BK), CW-C4000E (MK)",nan,C13T52L320,25.6,4.0,nan,Physical,ok,True,1,6,6,Cartucho de Tinta Origina Epson SJIC41P-M Magenta,0,0,False,{},,259310,32990,27523,,30066
35533,AS151BRO62,"Brother DR411CL - Original - kit de tambor - para Brother HL-L8360CDW, MFC-L8900CDW",nan,DR411CL,137.7,3.0,nan,Physical,ok,True,1,30,+30,Tambor original Brother DR-411,0,0,False,{},,,,,,
45887,AS151BRO86,"Brother LC402Y - Amarillo - original - cartucho de tinta - para Brother MFC-J5340DW, MFC-J6540DW, MFC-J6940DW",nan,LC402YS,15.9,20.0,nan,Physical,ok,True,1,100,+100,Cartucho de Tinta Original Brother LC402YS Amarillo,0,0,False,{},,259335,19990,17240,,20515
45889,AS151BRO89,"Brother LC402XL - Alto rendimiento - cián - original - cartucho de tinta - para Brother MFC-J5340DW, MFC-J6540DW, MFC-J6940DW",nan,LC402XLCS,22.9,15.0,nan,Physical,ok,True,1,100,+100,Cartucho de Tinta Original Brother LC402XLCS Cyan,0,0,False,{},,259333,27990,25500,,27655
45884,AS151BRO93,"Brother LC402BK - Negro - original - cartucho de tinta - para Brother MFC-J5340DW, MFC-J6540DW, MFC-J6940DW",nan,LC402BKS,17.9,20.0,nan,Physical,ok,True,1,100,+100,Cartucho de Tinta Original Brother LC402BKS Negro,0,0,False,{},,259706,21990,19417,21990,22960
53201,AS152BRO11,"Brother - BTD100CMYK - Ink Bottle - Color (cyan, magenta, yellow, black) - Pack of 4 bottles",nan,BTD100CMYK,24.4,20.0,nan,Physical,ok,True,1,100,+100,	Pack 4 Botellas de Tinta Original Brother BTD100CMYK 4 Colores,0,0,False,{},,259822,27990,27500,37990,33046
13205,AS204EPS08,"Epson T673 - Cián claro - original - recarga de tinta - para Epson L1800, L800, L805, L810, L850; EcoTank L1800",nan,T673520-AL,11.2,20.0,nan,Physical,ok,True,1,100,+100,Botella de Tinta Original Epson  T673520-AL Cyan Claro,0,0,False,{},,259581,14990,9990,16990,14631
13207,AS204EPS07,"Epson T673 - Amarillo - original - recarga de tinta - para Epson L1800, L800, L805, L810, L850; EcoTank L1800",nan,T673420-AL,11.2,20.0,nan,Physical,ok,True,1,100,+100,Botella de Tinta Original Epson T673420-AL Amarillo ,0,0,False,{},,259580,13990,12025,16990,14642
13204,AS204EPS09,"Epson T673 - Magenta claro - original - recarga de tinta - para Epson L1800, L800, L805, L810, L850; EcoTank L1800",nan,T673620-AL,11.2,20.0,nan,Physical,ok,True,1,100,+100,Botella de Tinta Original Epson T673620-AL Magenta Claro ,0,0,False,{},,259582,13990,12025,16990,14843
17308,AS205EPS01,"Epson T7741 - 140 ml - negro - original - recarga de tinta - para Epson L1455, L605, L655, M100; EcoTank ET-4550, L1455, L606; WorkForce ET-16500, ET-4550",nan,T774120-AL,17.6,20.0,nan,Physical,ok,True,1,50,+50,Botella de Tinta Original Epson T774120-AL Negro,0,0,False,{},,261560,20990,18535,24990,22067
12951,AS206EPS26,"Epson T664 - Cián - original - recarga de tinta - para Epson L380, L386, L395, L495; EcoTank ET-2600, 2650, L1455, L396, L606, L656",nan,T664220-AL,7.1,20.0,nan,Physical,ok,True,1,100,+100,Botella de Tinta Original Epson T664220-AL Cyan ,0,0,False,{},,259504,8990,7660,9990,9335
12949,AS206EPS25,"Epson T664 - 70 ml - negro - recarga de tinta - para Epson L110, L200, L310, L380, L395, L495, L575, L606, L655, L656, L1300, L1455 ",nan,T664120-AL,7.1,20.0,nan,Physical,ok,True,1,100,+100,Botella de Tinta Original Epson T664120-AL Negro,0,0,False,{},,259506,8990,7660,8990,9567
12952,AS206EPS27,"Epson T664 - Magenta - original - cartucho de tinta - para Epson L380, L386, L395, L495; EcoTank ET-2600, 2650, L1455, L396, L606, L656",nan,T664320-AL,7.1,20.0,nan,Physical,ok,True,1,100,+100,Botella de Tinta Original Epson T664320-AL Magenta ,0,0,False,{},,259505,8990,7660,9990,9251
12956,AS206EPS28,"Epson T664 - Amarillo - original - recarga de tinta - para Epson L380, L386, L395, L495; EcoTank ET-2600, 2650, L1455, L396, L606, L656",nan,T664420-AL,7.1,20.0,nan,Physical,ok,True,1,100,+100,Botella de Tinta Original Epson T664420-AL Amarillo ,0,0,False,{},,259502,8990,7660,9990,9474
32649,AS207EPS31,"Epson 748XXL - XL - cián - original - blíster con alarmas de RF/acústica - cartucho de tinta - para WorkForce Pro WF-6090, WF-6590, WF-8090, WF-8090 D3TWC, WF-8590, WF-8590 D3TWFC",nan,T748XXL220-AL,59.7,20.0,nan,Physical,ok,True,1,50,+50,Cartucho de Tinta Original Epson T748XXL220-AL Cyan,0,0,False,{},,259881,72990,62780,72990,69624
34019,AS208EPS23,Epson - Ink cartridge - Black - T941120-AL ,nan,T941120-AL,28.5,20.0,nan,Physical,ok,True,1,50,+50,Bolsa-Tinta Negra T941,0,0,False,{},,259690,37990,29995,36990,36906
34020,AS208EPS24,Epson - Ink cartridge - Cyan - T941220-AL,nan,T941220-AL,43.7,20.0,nan,Physical,ok,True,1,50,+50,Bolsa-Tinta Cyan T941,0,0,False,{},,259689,53990,47090,55990,52893
34022,AS208EPS27,Epson - Ink cartridge - Yellow - T941420-AL,nan,T941420-AL,43.7,20.0,nan,Physical,ok,True,1,50,+50,Bolsa-Tinta Amarillo T941,0,0,False,{},,259687,53990,46842,,51904
34021,AS208EPS26,Epson - Ink cartridge - Magenta - T941320-AL,nan,T941320-AL,43.7,20.0,nan,Physical,ok,True,1,50,+50,Bolsa-Tinta Magenta T941,0,0,False,{},,259811,53990,48133,,52721
33411,AS208EPS53,"Epson T40W - 80 ml - gran capacidad - negro - original - blíster con alarmas de RF/acústica - cartucho de tinta - para SureColor T2170, T3170, T3170M, T5170, T5170M",nan,T40W120,50.1,20.0,nan,Physical,ok,True,1,30,+30,Tintas-Cartridge T40W120 Negro / 80ml,0,0,False,{},,259940,59990,54466,59990,60176
34153,AS209EPS04,"Epson - T534120-AL - 6,000 pag - Original - Negro - para Epson M1000, M1120, M1180, M2120, M2140, M2170, M3170, M3180",nan,T534120-AL,14.0,20.0,nan,Physical,ok,True,1,100,+100,Botella de Tinta Original Epson T534120-AL Negro,0,0,False,{},,259584,16990,14994,19990,18131
33414,AS208EPS56,"Epson T40W - 50 ml - gran capacidad - amarillo - original - blíster con alarmas de RF/acústica - cartucho de tinta - para SureColor T2170, T3170, T3170M, T5170, T5170M",nan,T40W420,36.3,20.0,nan,Physical,ok,True,1,50,+50,Cartucho de Tinta Original Epson T40W420 Amarillo / 50ml,0,0,False,{},,259941,44990,39370,,44912
54588,AS209EPS29,Epson WorkForce - Ink cartridge - C5310/90& C5810/90,nan,T11A220-AL,49.4,20.0,nan,Physical,ok,True,1,23,23,Bolsa de Tinta Epson T11A220-AL Cyan,0,0,False,{},,259981,62990,53900,,59346
36562,AS209EPS15,Epson - 206 - Ink cartridge - Cyan,nan,T206220-AL,12.6,20.0,nan,Physical,ok,True,1,50,+50,Cartucho de Tinta Original Epson T206220-AL Cyan,0,0,False,{},,259574,15990,13900,,15776
54590,AS209EPS31,"Epson WorkForce - Ink cartridge - C5310/90 & C5810/90,",nan,T11A420-AL,49.4,20.0,nan,Physical,ok,True,1,50,+50,Bolsa de Tinta Epson T11A420-AL Amarilla,0,0,False,{},,259977,62990,53900,,59171
54589,AS209EPS30,Epson WorkForce - Ink cartridge - C5310/90 & C5810/90,nan,T11A320-AL,49.4,20.0,nan,Physical,ok,True,1,50,+50,Bolsa de Tinta Epson T11A320-AL Magenta,0,0,False,{},,259980,62990,53900,,58500
49682,AS209EPS43,Epson - T574220 - Ink refill - Cyan,nan,T574220-AL,8.7,20.0,nan,Physical,ok,True,1,100,+100,Botella de Tinta Original Epson T574220-AL Cyan,0,0,False,{},,259307,10990,9390,13990,11570
49685,AS209EPS46,Epson - T574520 - Ink refill - Yellow / Light cyan,nan,T574520-AL,8.7,20.0,nan,Physical,ok,True,1,100,+100,Botella de Tinta Original Epson T574520-AL Cyan Claro,0,0,False,{},,259304,10990,10200,13990,12318
49683,AS209EPS44,Epson - T574320 - Ink refill - Magenta,nan,T574320-AL,8.7,20.0,nan,Physical,ok,True,1,100,+100,Botella de Tinta Original Epson T574320-AL Magenta,0,0,False,{},,259306,10990,9390,13990,11597
49684,AS209EPS45,Epson - T574420 - Ink refill - Yellow,nan,T574420-AL,8.7,20.0,nan,Physical,ok,True,1,100,+100,Botella de Tinta Original Epson T574420-AL Amarillo,0,0,False,{},,259305,10990,9390,13990,11540
10595,AS220HEW01,"HP 950 - 24 ml - negro - original - cartucho de tinta - para Officejet Pro 251dw, 276dw, 8100, 8600, 8610, 8620, 8630",nan,CN049AL,35.3,20.0,nan,Physical,ok,True,1,13,13,Cartucho de Tinta Original HP 950 Negro ,0,0,False,{},,259478,42990,39426,44990,43714
9007,AS217HEW56,"HP 122 - Negro - original - cartucho de tinta - para Deskjet 1010, 10XX J410, 1512, 2050 J510, 2050A J510, 2054A J510, 25XX, Envy 4502",nan,CH561HL,14.4,20.0,nan,Physical,ok,True,1,100,+100,Cartucho de Tinta Original HP 122  Negro ,0,0,False,{},,260067,18990,16034,21990,18969
9008,AS217HEW57,"HP 122 - 1.5 ml - amarillo, cián, magenta - original - cartucho de tinta - para Deskjet 1000 J110, 10XX J410, 2050 J510, 2050A J510, 2054A J510, Ink Advantage 2060 K110",nan,CH562HL,17.4,20.0,nan,Physical,ok,True,1,100,+100,Cartucho de Tinta Original HP 122 Tricolor ,0,0,False,{},,259568,20990,19462,23990,21830
32857,AS220HEW06,"HP 951XL - 17 ml - Alto rendimiento - magenta - original - cartucho de tinta - para Officejet Pro 251, 276, 8100, 8600, 8600 N911, 8610, 8615, 8616, 8620, 8625, 8630, 8640",nan,CN047AL,41.5,20.0,nan,Physical,ok,True,1,22,22,Cartucho de Tinta Original HP 951XL Magenta ,0,0,False,{},,259485,49990,45500,49990,49490
10599,AS220HEW03,"HP 951 - 8 ml - magenta - original - cartucho de tinta - para Officejet Pro 251, 276, 8100, 8600, 8600 N911, 8610, 8615, 8616, 8620, 8625, 8630, 8640",nan,CN051AL,24.8,20.0,nan,Physical,ok,True,1,30,+30,Cartucho de Tinta Original HP 951 Magenta ,0,0,False,{},,259494,32990,23990,,30385
32856,AS220HEW07,"HP 951XL - 17 ml - Alto rendimiento - amarillo - original - cartucho de tinta - para Officejet Pro 251dw, 276dw, 8100, 8600, 8600 N911a, 8610, 8615, 8620, 8625, 8630",nan,CN048AL,41.6,20.0,nan,Physical,ok,True,1,11,11,Cartucho de Tinta Original HP 951XL Amarillo ,0,0,False,{},,259482,49990,44480,,48964
12548,AS220HEW11,"HP 662XL - Alto rendimiento - negro - original - Ink Advantage - cartucho de tinta - para Deskjet 1516, Ink Advantage 15XX, Ink Advantage 35XX, Ink Advantage 4645",nan,CZ105AL,24.8,20.0,nan,Physical,ok,True,1,100,+100,Cartucho de Tinta Original HP 662 XL Negro ,0,0,False,{},,260088,,74980,,74980
32854,AS220HEW08,"HP 950XL - 53 ml - Alto rendimiento - negro - original - cartucho de tinta - para Officejet Pro 251dw, 276dw, 8100, 8600, 8610, 8620, 8630",nan,CN045AL,60.0,20.0,nan,Physical,ok,True,1,30,+30,Cartucho de Tinta Original HP 950 XL Negro ,0,0,False,{},,259487,76990,63592,71990,70187
11936,AS220HEW13,"HP 670 - 14 ml - negro - original - Ink Advantage - cartucho de tinta - para Deskjet Ink Advantage 3525, Ink Advantage 46XX, Ink Advantage 5525, Ink Advantage 6525",nan,CZ113AL,11.7,20.0,nan,Physical,ok,True,1,27,27,Cartucho de Tinta Original HP 670 Negro ,0,0,False,{},,260020,14990,13500,14990,14972
16429,AS220HEW40,"HP 933XL - 8.5 ml - Alto rendimiento - magenta - original - cartucho de tinta - para Officejet 6100, 6600 H711a, 6700, 7110, 7510, 7610, 7612",nan,CN055AL,19.4,20.0,nan,Physical,ok,True,1,30,+30,Cartucho de Tinta Original HP 933 XL Magenta ,0,0,False,{},,260097,25990,22164,,25414
21092,AS220HEW54,HP - Ink cartridge - Tricolor - 664,nan,F6V28AL,10.8,20.0,nan,Physical,ok,True,1,100,+100,Cartucho de Tinta Original HP 664 Tricolor,0,0,False,{},,259888,13990,11992,14990,14650
21091,AS220HEW55,HP - Ink cartridge - Black 664,nan,F6V29AL,10.8,20.0,nan,Physical,ok,True,1,100,+100,Cartucho de Tinta Original HP 664 Negro ,0,0,False,{},,259889,13990,11992,14990,15513
21093,AS220HEW57,HP - Ink cartridge - Black - 664XL,nan,F6V31AL,32.8,20.0,nan,Physical,ok,True,1,1,1,Cartucho de Tinta Original HP 664 XL Negro ,0,0,False,{},,259566,42990,33940,,41280
23809,AS220HEW60,HP - 974X - Ink cartridge - Black,nan,L0S08AL,140.9,19.0,nan,Physical,ok,True,1,30,+30,Tintas-Cartridge L0S08AL Negro 974 XL,0,0,False,{},,259797,207990,181040,,195356
23816,AS220HEW62,HP - 974X - Ink cartridge - Magenta,nan,L0S02AL,158.3,5.0,nan,Physical,ok,True,1,30,+30,Tintas-Cartridge L0S02AL Magenta 974 XL,0,0,False,{},,259796,189990,160990,,176579
34081,AS221HEW88,HP - 964XL - Ink cartridge - Magenta,nan,3JA55AL,42.1,20.0,nan,Physical,ok,True,1,100,+100,Cartucho de Tinta Original HP 964 XL Magenta ,0,0,False,{},,259549,55990,47690,49990,51882
35016,AS221HEW97,"HP - GT53 - Ink cartridge - Black - 1VV22AL - Botella de tinta HP GT53 Negro 4,000 Págs",nan,1VV22AL,8.2,20.0,nan,Physical,ok,True,1,100,+100,Botella de Tinta Original HP GT53 Negro,0,0,False,{},,260082,10990,8900,11990,10881
40532,AS222HEW14,HP - 667XL - Ink cartridge - Black - 3YM81AL,nan,3YM81AL,32.8,20.0,nan,Physical,ok,True,1,100,+100,Cartucho de Tinta Original HP  667 XL Negro,0,0,False,{},,259777,39990,36311,45990,42341
40530,AS222HEW12,HP - 667 - Ink cartridge - Black - 3YM79AL,nan,3YM79AL,10.4,20.0,nan,Physical,ok,True,1,100,+100,Cartucho de Tinta Original HP  667 Negro,0,0,False,{},,260091,,29990,,32803
23418,AS251HEW01,HP - Ink cartridge - Cyan - Model 954 700 pages,nan,L0S50AL,26.1,20.0,nan,Physical,ok,True,1,100,+100,Cartucho de Tinta Original HP 954 Cyan ,0,0,False,{},,259507,32990,23190,,35063
32862,AS251HEW06,"HP - 954xl - Ink cartridge - Magenta - 1,600 pages",nan,L0S65AL,48.5,20.0,nan,Physical,ok,True,1,100,+100,Cartucho de Tinta Original HP 954 XL Magenta ,0,0,False,{},,259503,57990,48667,56990,54308
23421,AS251HEW08,HP - Ink cartridge - Black - Model 954 1000 pages,nan,L0S59AL,37.6,20.0,nan,Physical,ok,True,1,50,+50,Cartucho de Tinta Original HP 954 Negro ,0,0,False,{},,259514,47990,33900,47990,43288
23420,AS251HEW09,HP - Ink cartridge - Yellow - Model 954 700 pages,nan,L0S56AL,26.1,20.0,nan,Physical,ok,True,1,30,+30,Cartucho de Tinta Original HP 954 Amarillo ,0,0,False,{},,259513,30990,26900,30990,31848
23419,AS251HEW10,HP - Ink cartridge - Magenta - Model 954 700 pages,nan,L0S53AL,26.0,20.0,nan,Physical,ok,True,1,50,+50,Cartucho de Tinta Original HP 954 Magenta ,0,0,False,{},,259511,33990,24240,,31532
33805,AT100BRO40,"Brother TN316C - Alto rendimiento - cián - original - cartucho de tóner - para Brother DCP-L8400CDN, HL-L8350CDW, HL-L8350CDWT, MFC-L8600CDW, MFC-L8850CDW",nan,TN316C,96.8,1.0,nan,Physical,ok,True,1,3,3,Toner Original Brother TN-316 Cyan,0,0,False,{},,259733,129990,107500,,115259
32858,AT100HEW02,"HP 26A - Negro - original - LaserJet - cartucho de tóner (CF226A) - para LaserJet Pro M402, MFP M426",nan,CF226A,154.0,20.0,nan,Physical,ok,True,1,50,+50,Toner Original HP 26A LaserJet Negro,0,0,False,{},,259615,164990,129900,164990,158717
16631,AT101HEW18,"HP 83A - Negro - original - LaserJet - cartucho de tóner (CF283A) - para LaserJet Pro M201, M202, MFP M125, MFP M127, MFP M225",nan,CF283A,77.1,20.0,nan,Physical,ok,True,1,100,+100,Toner Original HP 83A LaserJet Negro  ,0,0,False,{},,259631,92990,68990,,91874
22635,AT151BRO41,"Brother TN3479 - Súper Alto Rendimiento - original - cartucho de tóner - para Brother DCP-L5650, HL-L5100, HL-L6400, MFC-L5900, MFC-L6700",nan,TN3479,118.6,20.0,nan,Physical,ok,True,1,100,+100,Toner Original Brother TN-3479 Negro,0,0,False,{},,259537,149990,127500,152990,140662
33808,AT151BRO63,Brother TN - TN411BK - Toner cartridge - Black,nan,TN411BK,51.7,20.0,nan,Physical,ok,True,1,30,+30,Toner Original Brother TN-411 Negro,0,0,False,{},,259617,70990,54995,,63165
32719,AT151BRO42,"Brother TN3499 - Ultra High Yield - original - cartucho de tóner - para Brother HL-L6400DW, HL-L6400DWT, HL-L6400DWTT, MFC-L6900DW, MFC-L6900DWT",nan,TN3499,152.9,10.0,nan,Physical,ok,True,1,30,+30,Toner Original Brother TN-3499 Negro,0,0,False,{},,259667,184990,159900,,178017
33809,AT151BRO64,Brother TN - TN411C - Toner cartridge - Cyan,nan,TN411C,57.7,20.0,nan,Physical,ok,True,1,50,+50,Toner Original Brother TN-411 Cyan,0,0,False,{},,259736,69990,62315,,67854
33810,AT151BRO65,Brother TN - TN411M - Toner cartridge - Magenta,nan,TN411M,57.7,20.0,nan,Physical,ok,True,1,50,+50,Toner Original Brother TN-411 Magenta,0,0,False,{},,259737,69990,62315,,67580
33812,AT151BRO71,Cartucho de Tóner Brother TN - TN419BK,nan,TN419BK,94.0,20.0,nan,Physical,ok,True,1,100,+100,Toner Original Brother TN-419 Negro,0,0,False,{},,259704,119990,96900,110000,110438
33811,AT151BRO66,Brother TN - TN411Y - Toner cartridge - Yellow,nan,TN411Y,57.7,20.0,nan,Physical,ok,True,1,50,+50,Toner Original Brother TN-411 Amarillo,0,0,False,{},,259738,69990,39990,,66951
