pcf_id,ingram_part,description,vendor_name,vendor_part,customer_price,available_qty,category,subcategory,api_status,mayorista,lista,stock_pcf,stock_raw,nombre_pcf,precio_normal,precio_oferta,ficha_vacia,stock_detail,error,solotodo_id,pcf_price,min_price,mode_price,mean_price
10717,1004024,TINTA HP 72 130 ML MAGENTA,Hp,C9372A,90.94,1,Suministros y Medios,Suministros Inyección de Tinta,ok,True,0,0,0,Cartridge-Tintas C9372A Magenta 72,0,0,False,{},,375345,,783090,,783090
1409,1004249,TONER HP 36A NEGRO 2000 PAG,Hp,CB436A,94.43,10,Suministros y Medios,Suministros Láser,ok,False,0,0,0,Toner Original HP CB436A Negro,0,0,False,{},,260115,,92046,,101568
9007,1252840,CARTUCHO TINTA HP 122 NEGRO,Hp,CH561HL,14.15,28,Suministros y Medios,Suministros Inyección de Tinta,ok,True,0,0,0,Cartucho de Tinta Original HP 122  Negro ,0,0,False,{},,260067,,16500,21990,19043
10600,1864296,CARTUCHO TINTA HP 951 AMARILLO 700 PÃG,Hp,CN052AL,24.8,11,Suministros y Medios,Suministros Inyección de Tinta,ok,True,0,0,0,Cartucho de Tinta Original HP 951 Amarillo ,0,0,False,{},,259491,,26490,,30078
20462,2515871,TONER HP 130A CYAN,Hp,CF351A,65.02,1,Suministros y Medios,Suministros Láser,ok,True,0,0,0,Toner Original HP 130A Cyan,0,0,False,{},,259565,,78421,,86103
28890,2550222,TINTA T694300 MAGENTA 700ML,Epson,T694300,231.13,2,Suministros y Medios,Suministros Inyección de Tinta,ok,False,0,0,0,Tintas - Cartridge T694300 Magenta T-Series,0,0,False,{},,259933,,255957,,271052
23395,2707204,CARTUCHO DE TINTA CL-146 XL COLOR,Canon,8276B001,24.01,80,Suministros y Medios,Suministros Inyección de Tinta,ok,False,0,0,0,Cartucho de Tinta Original Canon CL-146 XL Color,0,0,False,{},,259674,,26900,,26900
19884,2839904,LS150 Campus Backpack Black 15.6IN,Kensington,K62617WW,20.03,1,Computadores Servidores y Notebooks,Bolsos y Mochilas p/Notebooks,ok,False,0,0,0,"Mochila para Notebook Campus 15.6"" - Negro  ",0,0,False,{},,,,,,
51747,3238566,ThinkPad 15.6 Basic Backpack,Lenovo,4X40K09936,12.58,486,Computadores Servidores y Notebooks,Bolsos y Mochilas p/Notebooks,ok,True,0,0,0,"Mochila ThinkPad 15,6"" Negra",0,0,False,{},,,,,,
55801,3405717,"Docking Station USB 3.1 SATA 2,5 y 3,5",Startech.Com,SDOCKU313E,88.91,1,Dispositivos de Almacenamiento,Componentes para Racks y Cajas de Discos,ok,False,0,0,0,Docking USB 3.1 SATA 2 5 y 3 5,0,0,False,{},,,,,,
54936,3612483,Soporte VESA 2 Monitores de 27,Startech.Com,ARMDUALV,85.2,1,Pantallas,"Brazos, Pedestales, Montaje p/Monitores",ok,False,0,0,0,Soporte VESA 2 Monitores de 27,0,0,False,{},,,,,,
35532,3606223,BANDEJA LT340CL,Brother,LT340CL,156.47,4,Impresoras,"Bandejas, Cajones y Alimentadores Sobre",ok,True,0,0,0,Bandeja de Papel adicional 500 hojas  MFC-L8900CDW,0,0,False,{},,,,,,
54935,3606349,Soporte de pared para monitor VESA,Startech.Com,ARMWALL,26.04,1,Pantallas,"Brazos, Pedestales, Montaje p/Monitores",ok,False,0,0,0,Soporte de pared para monitor VESA,0,0,False,{},,,,,,
55819,3741267,DS2278-SR BLACK PRESENTATION CRADLE USB,Zebra,DS2278-SR7U2100PRW,149.65,28,Productos POS/AIDC/Código de Barras,Escáners Portátiles (handheld),ok,True,0,0,0,Lector de Barra DS2278,0,0,False,{},,,,,,
28953,3962921,TONER HP 204A NEGRO 1100 PAG,Hp,CF510A,57.45,2,Suministros y Medios,Suministros Láser,ok,True,0,0,0,Toner Original HP 204A LaserJet Negro ,0,0,False,{},,259618,,69990,,71583
56190,4213424,BACK UPS BV 650VA AVR UNIVERSAL OUT 230V,Apc,BV650I-MS,95.8,9,Protección Eléctrica y Racks,UPS,ok,False,0,0,0,BACK UPS BV 650VA AVR UNIVERSAL OUT 230V,0,0,False,{},,79205,,83890,,94326
35078,4492534,HP 104A Blk Laser Imaging Drum,Hp,W1104A,63.98,8,Suministros y Medios,Suministros Láser,ok,True,0,0,0,Tambor original HP 104A,0,0,False,{},,,,,,
38706,4630948,M1180 B/N ECOTANK 39 PPM A4,Epson,C11CG94303,301.05,2,Impresoras,Impresoras de Inyección de Tinta,ok,False,0,0,0,Impresora Tinta Continua Blanco y Negro EcoTank M1180 WiFi / Ethernet / Dúplex / Mobile Print,0,0,False,{},,70152,,329564,,339649
42143,5056898,"APC Easy Back-UPS 700VA, 230V, AVR USB C",Apc,BVX700LUI-MS,101.52,11,Protección Eléctrica y Racks,UPS,ok,True,0,0,0,UPS 700VA/360W Easy-UPS BVX Interactiva,0,0,False,{},,112895,,87278,,106439
50265,5064144,KTG CLICKSAFE 2.0 KEYED LOCK WITH TBAR/N,Kensington,K68102WW,32.44,9,Seguridad Física,Opciones de Seguridad Física y Accs,ok,False,0,0,0,Candado ClickSafe® 2.0 Universal 3 en 1,0,0,False,{},,,,,,
42505,5232344,TM-T20IIIL-001:USB+SRL;AC;EBCK,Epson,C31CH26001,123.96,9,Impresoras,Impresoras de Recibos Térmicas,ok,False,0,0,0,Impresora POS Térmica TM-T20IIIL-001  Serial y USB,0,0,False,{},,,,,,
54940,5323060,Mobile Projector and Laptop Stand/Cart,Startech.Com,ADJPROJCART,98.29,1,Dispositivos Audio/Video,Bolsos; Fundas y Carros para Proyectores,ok,False,0,0,0,Mobile Projector and Laptop Stand/Cart,0,0,False,{},,,,,,
54954,5352564,Aruba 6000 24G CL4 4SFP Swch,Hewlett Packard Enterprise,R8N87A,881.57,2,Dispositivos de Red,Switches Estaqueables,ok,True,0,0,0,Aruba 6000 24G CL4 4SFP Swch,0,0,False,{},,384792,,1090144,,1103274
54991,5574070,HP LaserJet Pro MFP 4103fdw Printer,Hp,2Z629A,278.51,65,Impresoras,Multifuncionales Láser Mono,ok,True,0,0,0,Multifuncional Láser Blanco y Negro LaserJet Pro MFP 4103fdw,0,0,False,{},,151336,,315588,327900,341233
55413,5574170,P3 PLUS 4000GB 3D NAND NVME PCIE M.2 SSD,Crucial,CT4000P3PSSD8,419.58,9,Dispositivos de Almacenamiento,Discos de Estado Sólido PCIe (SSD),ok,True,0,0,0,Unidad SSD 4TB P3 PLUS 3D NAND NVME PCIE M.2 SSD,0,0,False,{},,211825,,457824,,493252
56084,5625812,"Printer ZC300, Dual Sided, US Cord, USB",Zebra,ZC32-000CQ00LA00,1262.1,8,Impresoras,Impresoras de Tarjetas de Identificación,ok,True,0,0,0,Impresoras de tarjetas ZC300,0,0,False,{},,,,,,
49020,5701062,MONITOR LS32BG650EL SMART CURVO 2560X144,Samsung,LS32BG650ELXZS,298.73,9,Computadores Servidores y Notebooks,Tablets y Tablet PCs,ok,True,0,0,0,"Monitor Gamer Samsung Curvo 32"", QHD, 240Hz, VA, 1ms,  HDR600, FreeSync Premium Pro, Odyssey G6 LS32BG650ELXZS",0,0,False,{},,177968,,393590,,421691
48097,5701381,2TB Canvio Basics USB 3.0 Black,Toshiba,HDTB520XK3AA,87.03,1324,Dispositivos de Almacenamiento,Discos Duros USB,ok,True,0,0,0,"Disco Externo 2TB 2.5"" USB 3.0 Canvio Basics Black A5",0,0,False,{},,183082,,79990,,95992
51064,5939021,IMPRESORA LASER MONO HLL5210DN,Brother,HLL5210DN,238.78,6,Impresoras,Impresoras Láser/LED monocromáticas,ok,False,0,0,0,Impresora Láser Blanco y Negro HLL-5210DN Ethernet,0,0,False,{},,228424,,244990,,274072
51061,5939668,TONER TN3619XL,Brother,TN3619XL,186.57,11,Suministros y Medios,Suministros Láser,ok,True,0,0,0,Toner Original Brother TN-3619XL Negro,0,0,False,{},,259761,,219990,,231381
51746,6080874,8TB RED PLUS 256MB CMR 3.5IN SATA 6GB/S,Western Digital,WD80EFPX,223.64,63,Dispositivos de Almacenamiento,Discos Duros SATA,ok,True,0,0,0,Disco Duro NAS 8TB Red Plus,0,0,False,{},,237006,,265900,,302085
49373,6128049,MONITOR OMEN 24 23.8-INCH FHD 165HZ,Hp,780D9AA#AKH,155.14,1,Pantallas,Monitores LCD/LED,ok,False,0,0,0,"Monitor Gamer 24"" Omen - Full HD, Panel IPS, 165Hz(1ms), FreeSync Premium (Pivoteable) (780D9AA)",0,0,False,{},,,,,,
52571,6210478,MFCL2880DW MONO LASER MULTIFUNCTION,Brother,MFCL2880DW,267.6,7,Impresoras,Multifuncionales Láser Color,ok,True,0,0,0,Multifuncional Láser Blanco y Negro MFC-L2880DW WiFi / Ethernet / Dúplex,0,0,False,{},,,,,,
56390,6213903,14-EK0003LA X360 I5 512SSD W11H,Hp,8D0D8LA#ABM,802.63,6,Computadores Servidores y Notebooks,Notebooks,ok,True,0,0,0,"Notebook HP Pavilion 360 2-in-1 4-ek0003la Intel Core i5 14"" Touch FHD 8GB 512GB Windows 11 Home",0,0,False,{},,,,,,
52373,6217522,FLEX 5 R7 8845HS 16GB 512SSD 14IN W11H,Lenovo,83DR0038CL,768.7,11,Computadores Servidores y Notebooks,Detachables,ok,True,0,0,0,"Notebook AI PC Ideapad Slim 5 AMD Ryzen 7-8845HS 14"" FHD 60Hz Touch 16GB 512GB SSD Windows 11 Home Luna Grey + Digital Pen ",0,0,False,{},,248126,,851900,,870151
55851,6268204,RAM XPG DDR5 LANCERB RGB 16GB 6000MHZ BK,Adata Technology,AX5U6000C4816G-SLABRBK,218.88,229,Componentes de Sistema,Memoria Genérica,ok,True,0,0,0,Memoria RAM DDR5 16GB 6000 MHz UDIMM XPG RGB ,0,0,False,{},,256061,,198900,198900,238757
52799,6278451,MOCHILA PORTATIL LITE KTG SIMPLY 16 VER,Kensington,K60397WW,10.29,20,Computadores Servidores y Notebooks,Bolsos y Mochilas p/Notebooks,ok,False,0,0,0,"Mochila para Notebook Simply Portable Waterproof 16"" - Verde",0,0,False,{},,,,,,
55497,6329367,AIO 245 G10 R5-7520U RAM 16G 512GB WP,Hp,9E3C6LA#ABM,695.28,1,Computadores Servidores y Notebooks,Computadores con Monitor integrado,ok,False,0,0,0,"All in One 245 G10 AMD Ryzen 5-7520U 16GB 512GB SSD 23.8"" FHD Windows 11 Pro ",0,0,False,{},,,,,,
55363,6332145,PC45 TRANSFERENCIA TÉRMICA LCD FUENTE LA,Honeywell,PC45T010000201,550.0,2,Impresoras,Impresoras de Recibos Térmicas,ok,False,0,0,0,Impresora de Etiquetas PC45T,0,0,False,{},,,,,,
56241,6332146,MSI MINI PC CUBI CUBI 5 12M-086BUS CI3,Msi,936-B0A811-086,198.07,21,Computadores Servidores y Notebooks,Computadores Small Form/Ultra Slim,ok,False,0,0,0,MINI PC CUBI 5 12M-086BUS CI3,0,0,False,{},,,,,,
52644,6338368,MONITOR LS27DG600SL G6 OLED 2560X1440,Samsung,LS27DG600SLXZS,765.22,1,Pantallas,Monitores LCD/LED,ok,False,0,0,0,"Monitor Gamer Samsung 27"", QHD, 360Hz, OLED, 0.03ms, HDR10, FreeSync Premium Pro, Odyssey G6 LS27DG600SLXZS",0,0,False,{},,248092,,699990,699990,740395
54693,6341227,SSD P310 2000GB PCIE GEN4 2280 NVME M.2,Crucial,CT2000P310SSD8,233.91,42,Dispositivos de Almacenamiento,Discos de Estado Sólido PCIe (SSD),ok,True,0,0,0,Unidad SSD 2TB SSD M.2 NVMe 7100MB/s,0,0,False,{},,259326,,229900,,239945
53592,6356822,AMD RYZEN 7 9800X3D 8CORE RADEON 5200MHZ,Amd,100-100001084WOF,436.47,25,Componentes de Sistema,Procesadores AMD,ok,True,0,0,0,CPU AMD Ryzen 7 9800X3D (AM5),0,0,False,{},,260863,,484890,,530461
55682,6363035,MAGIC KEYBOARD-LAM,Apple,MXCL3LA/A,88.88,62,Dispositivos de Entrada,Teclados,ok,True,0,0,0,Magic Keyboard (USB-C) - Español (América Latina),0,0,False,{},,270449,,102404,,111085
56098,6359578,G11 ULTRA 9 185H RAM 16GB SSD 1TB 16IN,Hp,A31DRLT#ABM,2969.8,2,Computadores Servidores y Notebooks,Notebooks,ok,False,0,0,0,"Notebook Zbook Power G11 Intel Ultra 9-185H 16GB RAM 1TB SSD 16"" RTX A1000 6GB Windows 11 Pro A31DRLT#ABM",0,0,False,{},,,,,,
54998,6368103,MBP 16 SB/14C CPU/20C GPU/24GB/512G-CHL,Apple,MX2X3CI/A,2510.8,1,Computadores Servidores y Notebooks,Notebooks,ok,False,0,0,0,"Macbook Pro 16"" M4 Pro 24GB 512GB SSD Space Black macOS MX2X3CI/A",0,0,False,{},,257121,,2149990,,2413460
55174,6368789,IMAC 24IN SLV/10C CPU/10C GPU/16GB/512-C,Apple,MWUV3CI/A,1812.4,24,Computadores Servidores y Notebooks,Computadores con Monitor integrado,ok,False,0,0,0," iMac 24"" Retina 4,5K (Chip M4, 16GB RAM, 512GB SSD) - Color Plata",0,0,False,{},,256932,,1949990,,2038945
55282,6380083,SSD 3840(GB) 5400 PRO NAND FLASH SATA 2.,Micron,MTFDDAK3T8TGA-1BC1ZABYYR,638.76,6,Dispositivos de Almacenamiento,Discos de Estado Sólido USB (SSD),ok,False,0,0,0,"Unidad SSD 5400 Pro 3.84TB SATA 2.5""",0,0,False,{},,263128,,,,
53179,6384078,MONITOR GAMER SAMSUNG ODYSSEY G5 34IN,Samsung,LC34G55TWWLXZS,293.53,4,Pantallas,Monitores LCD/LED,ok,False,0,0,0,"Monitor Samsung Gamer Curvo 34"", UWQHD, 165Hz, VA, 1ms, FreeSync, LC34G55TWWLXZS",0,0,False,{},,98378,,289990,315990,306302
54581,6397869,ROG-ASTRAL-RTX5080-O16G-GAMING,Asus,90YV0LV0-M0AA00,1869.7,15,Componentes de Sistema,Tarjetas Gráficas nVidia,ok,True,0,0,0,Tarjeta de Video NVIDIA ROG ASTRAL RTX5080 O16G GAMING,0,0,False,{},,,,,,
56243,6500383,GeForce RTX 5070 12G GAMING TRIO OC,Msi,912-V532-019,737.01,5,Video Juegos y Consolas,Otros Accesorios para Videojuegos,ok,False,0,0,0,GeForce RTX 5070 12G GAMING TRIO OC,0,0,False,{},,,,,,
55236,6518304,HPE PROLIANT DL360 GEN11 4510 2.4GHZ 12C,Hewlett Packard Enterprise,P81428-DM5,11827.0,4,Computadores Servidores y Notebooks,Servidores en Rack,ok,False,0,0,0,Server HPE PROLIANT DL360 GEN11 4510 2.4GHZ 12C 1P 1X32GB R 8SFF NS204I U MR408I-O 2X800W PS LA SERVER,0,0,False,{},,,,,,
54311,6525536,TUF-RTX5090-O32G-GAMING,Asus,90YV0LY0-M0AA00,3530.7,10,Componentes de Sistema,Tarjetas Gráficas nVidia,ok,False,0,0,0,Tarjeta de Video ASUS NVIDIA TUF Gaming GeForce RTX 5090 32GB GDDR7 OC Edition,0,0,False,{},,,,,,
55994,6581698,B5405CCA LY0210X U7 255H 1TB SSD 32G 14I,Asus,90NX08I1-M007A0,1288.5,34,Computadores Servidores y Notebooks,Notebooks,ok,True,0,0,0,"Notebook ExpertBook B5 Intel Ultra 7 255H 32GB RAM 1 TB SSD 14"" Windows 11 Pro B5405CCA-LY0210X",0,0,False,{},,318374,,1488200,,1638240
56006,6591550,B1403CVA S62178X I7 13620H 1TB 16G 14IN,Asus,90NX0811-M02EH0,770.84,13,Computadores Servidores y Notebooks,Notebooks,ok,False,0,0,0,"Notebook ExpertBook B1 Intel Core i7-13620H 14"" 16GB 1TB SSD Windows 11 Pro B1403CVA-S62178X",0,0,False,{},,318310,,,,
54854,6611745,GeForce RTX 5060 8G GAMING TRIO OC,Msi,912-V537-021,433.16,28,Componentes de Sistema,Tarjetas Gráficas nVidia,ok,False,0,0,0,Tarjeta de Video NVIDIA GeForce RTX 5060 8G GAMING TRIO OC,0,0,False,{},,278490,,466900,,478902
55810,6628178,Lenovo Essential Wireless Combo KB & Mou,Lenovo,4X31R64500,45.67,2,Dispositivos de Entrada,Combos Teclado/Mouse,ok,True,0,0,0,Combo Teclado + Mouse Inalámbrico Essential Gen 2 - Negro,0,0,False,{},,358117,,27500,,33951
40843,6642852,HIGH SPEED HDMI CABLE WITH ETHERNET 1 8M,Kensington,K33020WW,4.48,180,Cables,Cables y Adaptadores de Audio + Video,ok,False,0,0,0,Cable HDMI/HDMI 2.0 de 1.8 metros,0,0,False,{},,,,,,
55499,6645061,PRO SFF 400 G9 I7-13700 8GB 512 W11P,Hp,9L8U9LA#ABM,710.56,4,Computadores Servidores y Notebooks,Computadores Desktop,ok,False,0,0,0,Desktop PRO SFF 400 G9 INTEL CORE I7-13700 RAM 8GB SSD 512 W11P,0,0,False,{},,,,,,
56253,6665062,PRO X870-P WIFI PRO Series,Msi,911-7E47-014,207.0,5,Componentes de Sistema,Tarjetas Madre AMD,ok,False,0,0,0,Placa MADRE AMD PRO X870-P WIFI PRO Series (sAM5),0,0,False,{},,,,,,
55881,6670437,ZBOOK X U9 285H NPU 32GB 1TB RTX 16IN,Hp,C2NN2LT#ABM,2357.6,17,Computadores Servidores y Notebooks,nan,ok,False,0,0,0,"Notebook ZBook X G1i Intel Ultra 9 285H 32GB RAM 1TB SSD 16"" NVIDIA RTX 1000 Ada 8GB Windows 11 Pro",0,0,False,{},,,,,,
55529,6677799,TC NEO 50A 24 CORE 5 210H 16G 512G W11P,Lenovo,12SD007LCS,748.47,35,Computadores Servidores y Notebooks,Computadores con Monitor integrado,ok,True,0,0,0,"All in One Thinkcentre Neo 50a Intel Core 5-210H 24""16GB 512GB SSD Windows 11 Pro 12SD007DCS",0,0,False,{},,361500,,787019,,873433
55544,6677796,TB G6 ULTRA 7 255HX 16GB 512GB 16 W11P,Lenovo,21R00029CL,1516.6,1,Computadores Servidores y Notebooks,Notebooks,ok,False,0,0,0,"Notebook AI PC ThinkPad Gen 6 Intel Ultra 7-255HX 16"" 16GB 512GB SSD Windows 11 Pro 21R00029CL",0,0,False,{},,364167,,1809044,,1809044
55551,6677801,TP X1 YOGA G10 U7 255U 32GB 1T W11P,Lenovo,21Q1000GCL,2001.0,29,Computadores Servidores y Notebooks,Detachables,ok,True,0,0,0,"Notebook AI PC ThinkPad X1 YOGA Gen 10 Intel Ultra 7-255U 14"" 32GB 1TB SSD Windows 11 Pro 21Q1000GCL",0,0,False,{},,364165,,2231156,,2313580
55475,6677819,TC NEO 50A 27 CORE 7 240H 16G 512G W11P,Lenovo,12SB006KCS,1122.2,1,Computadores Servidores y Notebooks,Computadores con Monitor integrado,ok,False,0,0,0,"All In One Thinkcentre Neo 50A  Intel Core 7-240H 27"" 16GB RAM 512GB SSD Windows 11 Pro",0,0,False,{},,360468,,,,
55541,6677815,TP L14 G6 RYZEN7 PRO 250 16GB 512GB W11P,Lenovo,21S9000NCL,1038.4,13,Computadores Servidores y Notebooks,Notebooks,ok,True,0,0,0,"Notebook ThinkPad L14 Gen 6 AMD Ryzen 7 PRO 250 14"" 16GB 512GB SSD Windows 11 Pro 21S9000NCL",0,0,False,{},,361318,,1119936,,1291157
56130,6697106,ZOTAC GAMING GEFORCE RTX 5080 SOLID OC,Zotac,ZT-B50800J2-10P,1432.2,4,Computadores Servidores y Notebooks,Componentes Terminales,ok,False,0,0,0,Tarjeta de Video GAMING GEFORCE RTX 5080 SOLID OC,0,0,False,{},,360889,,1593990,1593990,1594323
56050,6702910,PROYECTOR MW560C 4.000 LUM WXGA (1280X80,Benq,9H.JTD77.1NL,359.99,2,Dispositivos Audio/Video,Proyectores DLP,ok,True,0,0,0,"Proyector BenQ MW560C, DLP, 4.000 Lúmenes, 16:10, WXGA",0,0,False,{},,385789,,,,
55907,6707695,15-FB3038LA R7-260 24GB 1TB 15.6IN W11H,Hp,CJ3B2LA#ABM,1181.4,139,Computadores Servidores y Notebooks,Notebooks,ok,False,0,0,0,"Notebook Gamer Victus 15 AMD Ryzen 7 NVIDIA GeForce RTX 5050 15.6"" 24GB RAM 1TB SSD Windows 11 Home Silver 15-fb3038la",0,0,False,{},,,,,,
56153,6708598,245 G10 R5 753U RAM 8GB 512GB 14IN FREE,Hp,BM4G4AT#ABM,399.07,124,Computadores Servidores y Notebooks,Notebooks,ok,False,0,0,0,"Notebook 245 G10 14"" AMD Ryzen 5 7530U 8GB RAM 512GB SSD FREEDOS BM4G4AT#ABM",0,0,False,{},,,,,,
56010,6708601,245 G10 R5 7530U 8GB 512GB 14IN W11H,Hp,B84N3AT#AKH,447.34,92,Computadores Servidores y Notebooks,Notebooks,ok,False,0,0,0,"Notebook HP AMD Ryzen 5-7530U 14"" 8GB 512GB Windows 11 Home B84N3AT",0,0,False,{},,,,,,
56405,6708603,240R G10 I5 120U RAM 8GB 512GB 14IN FREE,Hp,C78E4AT#ABM,460.87,90,Computadores Servidores y Notebooks,Notebooks,ok,False,0,0,0,"Notebook HP 240R G10 Intel Core 5-120U 14"" 8GB 512GB SSD Windows 11 Home",0,0,False,{},,,,,,
56107,6709671,MBP 14 SB/10C/10C GPU/16GB/1TB-CHL,Apple,MDE14CI/A,1721.8,17,Computadores Servidores y Notebooks,Notebooks,ok,True,0,0,0,MacBook Pro M5 14.2″ 16GB 1TB SSD  Negro Espacial MacOS MDE14CI/A,0,0,False,{},,360394,,1849990,,2068593
55807,6717683,Lenovo Dual-Mode WL ANC auriculares 6550,Lenovo,4XD1S19778,70.31,20,Comunicaciones,Auriculares Bluetooth,ok,False,0,0,0,Lenovo Dual-Mode WL ANC Headset 6550,0,0,False,{},,383593,,,,
55935,6720118,V14 G5 IRL I7-13620H 16GB 512GB W11P,Lenovo,83GU0057CL,778.76,76,Computadores Servidores y Notebooks,Notebooks,ok,True,0,0,0,Notebook V14 G5 Intel Core i7-13620H 16GB RAM 512GB SSD 14″ Windows 11 Pro,0,0,False,{},,364090,,749990,,882088
56207,6737845,T360 + 6353P + 32GB + 2TB HDD + H755 + P,Dell,T360264_6353P2,3030.9,1,Computadores Servidores y Notebooks,Servidores Barebone,ok,False,0,0,0,"Server Dell PowerEdge T360 Xeon 6353P, 32GB DDR5, 2TB HDD, iDRAC9",0,0,False,{},,,,,,
56396,6738291,ELITEBOOK XG1A AI7PRO 360 32GB 1TB W11P,Hp,B8JS5AT#ABM,1430.9,8,Computadores Servidores y Notebooks,Notebooks,ok,False,0,0,0,Notebook EliteBook X G1a 14“ Touch AMD Ryzen AI 7 PRO 360 32GB RAM 1TB SSD Windows 11 Pro B8JS5AT#ABM ,0,0,False,{},,,,,,
55809,6739887,DUAL-MODE WRL HEADSET 6550 USB-A TEAMS,Lenovo,4XD1S19777,70.31,66,Comunicaciones,Auriculares Bluetooth,ok,True,0,0,0,DUAL-MODE WRL HEADSET 6550 USB-A TEAMS,0,0,False,{},,381049,,,,
56046,6751338,Samsung ViewFinity S5,Samsung,LS32FM801ULXZS,378.82,29,Pantallas,Monitores LCD/LED,ok,False,0,0,0,Samsung ViewFinity S5,0,0,False,{},,280096,,428104,459990,451147
55800,6751780,ZOTAC GAMING GEFORCE RTX 5070TI SOLID SF,Zotac,ZT-B50710J3-10P,1010.3,24,Computadores Servidores y Notebooks,Componentes Terminales,ok,False,0,0,0,Tarjeta de Video NVIDIA GeForce RTX 5070 Ti GAMING SOLID SFF OC,0,0,False,{},,362648,,1069990,,1144466
56412,6761911,DELL PRO 14 14255 RYZEN5 PRO 230 16GB 51,Dell,6F1NR,705.49,2,Computadores Servidores y Notebooks,Notebooks,ok,False,0,0,0,"Notebook Dell Pro-14 PC14255 AMD Ryzen 5-230 14"" 16GB 512GB SSD Windows 11 Pro",0,0,False,{},,379344,,789792,,792493
56399,6767160,PROONE 240 G10 U5-125U 16GB 512GB W11P,Hp,C3XB1LT#ABM,697.88,62,Computadores Servidores y Notebooks,Computadores con Monitor integrado,ok,True,0,0,0,"All in One ProOne 240 G10 23.8"" Intel Ultra 5 125U 16GB RAM 512GB SSD Windows 11 Pro",0,0,False,{},,,,,,
56261,6781732,RTX 5070 12G SHADOW 2X OC,Msi,912-V532-076,601.61,78,Componentes de Sistema,Tarjetas Gráficas nVidia,ok,False,0,0,0,Tarjeta de Video Nvidia Geforce RTX 5070 12G SHADOW 2X OC,0,0,False,{},,,,,,
55872,6786515,ZOTAC GAMING GEFORCE RTX 5070TI SOLID CO,Zotac,ZT-B50710Q2-10P,1010.3,9,Computadores Servidores y Notebooks,Componentes Terminales,ok,True,0,0,0,Tarjeta de Video NIVIDIA GEFORCE RTX 5070TI SOLID OC,0,0,False,{},,360887,,1149990,,1216326
56387,6788478,TOWER P3 G2 U9 285 VPRO 16GB 1TB W11P,Lenovo,30HT00AQCL,2677.0,2,Computadores Servidores y Notebooks,Workstations,ok,False,0,0,0,Desktop ThinkStation P3 Gen2 Intel Ultra 9 285 vPro 16GB RAM 1TB SSD NVIDIA RTX 2000 16GB Windows 11 Pro,0,0,False,{},,,,,,
56266,6789823,MB B850M GAMING WIFI6E,Msi,911-7E87-005,115.53,76,Componentes de Sistema,Tarjetas Madre AMD,ok,True,0,0,0,Placa Madre AMD B850M GAMING WIFI6E (sAM5),0,0,False,{},,,,,,
56267,6789824,MB PRO H610M-A DDR4,Msi,911-7E31-002,63.02,11,Componentes de Sistema,Tarjetas Madre Intel,ok,False,0,0,0,Placa Madre Intel PRO H610M-A DDR4 (s1700),0,0,False,{},,,,,,
56269,6791899,MAG A1000GLS PCIE5,Msi,306-7ZPIX23-CE0,102.02,183,Componentes de Sistema,Fuentes de Poder Genéricas,ok,False,0,0,0,MAG A1000GLS PCIE5,0,0,False,{},,,,,,
56270,6791900,MAG A850GLS PCIE5,Msi,306-7ZPIY23-CE0,79.35,128,Componentes de Sistema,Fuentes de Poder Genéricas,ok,False,0,0,0,Fuente de Poder MAG A850GLS PCIE5,0,0,False,{},,,,,,
56522,6797724,MBN 13 IND/8GB/256GB-INDIGO,Apple,MHFF4CI/A,589.03,10,Computadores Servidores y Notebooks,Notebooks,ok,True,0,0,0,Apple MacBook Neo (Early 2026 / Apple Silicon A18 5-Core GPU / 8 GB / 256 GB SSD / Indigo) [MHFF4CI/A],0,0,False,{},,383746,,599990,649990,642628
56439,6797728,MBN 13 BLS/8GB/256GB-BLUSH,Apple,MHFH4CI/A,589.03,22,Computadores Servidores y Notebooks,Notebooks,ok,True,0,0,0,"MacBook Neo A18 13"" 8GB 256GB SSD Blush macOS Tahoe MHFH4CI/A",0,0,False,{},,383748,,599990,649990,638980
56443,6805740,NB TP L14 G6 U7 16G 512G 11P,Lenovo,21S60043CL,1275.8,4,Computadores Servidores y Notebooks,Notebooks,ok,False,0,0,0,"Lenovo ThinkPad L14 Gen 6 Intel Core Ultra 7 255U 14"" LED 16GB 512GB SSD Windows 11 Pro",0,0,False,{},,384235,,,,
10720,1004029,TINTA HP 72 130 ML MATE NEGRO,Hp,C9403A,94.16,21,Suministros y Medios,Suministros Inyección de Tinta,ok,False,0,0,0,Tintas- Cartridge C9403A Negro Matte 72,0,0,False,{},,375345,,783090,,783090
11321,1021817,TONER HP 55A NEGRO 6000 PAG,Hp,CE255A,178.38,71,Suministros y Medios,Suministros Láser,ok,False,0,0,0,Toner CE255A Negro,0,0,False,{},,260072,,178900,,202760
9771,1403912,SP25 15 4 CLASSIC BACKPACK,Kensington,K63207,15.54,31,Computadores Servidores y Notebooks,Bolsos y Mochilas p/Notebooks,ok,True,0,0,0,"Mochila Notebook 15.6"" SP25 Negra",0,0,False,{},,,,,,
46623,1858357,305A CYAN LJ TONER CART CE411A,Hp,CE411A,144.31,51,Suministros y Medios,Suministros Láser,ok,False,0,0,0,Toner Original HP 305A Cyan,0,0,False,{},,259833,,133863,,160142
46624,1858359,305A MAGENTA LJ TONER CART CE413A,Hp,CE413A,146.13,50,Suministros y Medios,Suministros Láser,ok,False,0,0,0,Toner Original HP 305A Magenta,0,0,False,{},,259834,,133863,170990,166635
12549,2035427,CARTUCHO TINTA HP 662XL TRICOLOR,Hp,CZ106AL,30.41,71,Suministros y Medios,Suministros Inyección de Tinta,ok,False,0,0,0,Cartucho de Tinta Original HP 662 XL Tricolor ,0,0,False,{},,259775,,33246,,37750
11935,2035425,CARTUCHO TINTA HP 662 TRICOLOR,Hp,CZ104AL,10.72,2393,Suministros y Medios,Suministros Inyección de Tinta,ok,False,0,0,0,Cartucho de Tinta Original HP 662 Tricolor,0,0,False,{},,259559,,11854,16990,14442
32839,2510716,1m USB 2.0 A to Right Angle B Cable M/M,Startech.Com,USBAB1MR,5.79,3,Cables,Cables y Adaptadores USB,ok,False,0,0,0,Cable para Impresora USB A Macho a USB B 90° Macho 1 mt,0,0,False,{},,,,,,
30710,2692206,Cable 15cm Mini Jack Hembra a RCA Macho,Startech.Com,MUFMRCA,4.71,4,Cables,Cables y Adaptadores de Video,ok,False,0,0,0,Adaptador Audio Estéreo 3.5mm hembra a 2x RCA macho,0,0,False,{},,,,,,
18876,2758662,MFCPL2700DW MFL LASER B/N,Brother,MFCL2700DW,233.85,6,Impresoras,Multifuncionales Láser Mono,ok,True,0,0,0,Multifuncional Láser Blanco y Negro MFC-L2700DW WiFi / Ethernet / Dúplex,0,0,False,{},,,,,,
48724,3098284,Adaptador Red Gigabit USB-C,Startech.Com,US1GC301AU,46.35,4,Dispositivos de Entrada/Salida,Conmutadores para dispositivos USB,ok,False,0,0,0,USB 3.1 USB-C to Gigabit Network Adapter with E,0,0,False,{},,392112,,54678,,56799
24857,3385425,TONER HP 79A NEGRO 1000 PAG,Hp,CF279A,67.42,248,Suministros y Medios,Suministros Láser,ok,False,0,0,0,Toner Original HP 79A Negro ,0,0,False,{},,259623,,69542,74990,76289
55948,3570190,CARTUCHO TINTA HP 62XL TRICOLOR 415 PÃG,Hp,C2P07AL,53.35,56,Suministros y Medios,Suministros Inyección de Tinta,ok,False,0,0,0,Cartucho de tinta HP 62XL Tricolor,0,0,False,{},,260118,,60500,,65961
55017,3962863,TONER HP 202A NEGRO,Hp,CF500A,73.49,70,Suministros y Medios,Suministros Láser,ok,False,0,0,0,Toner Original HP 202A Negro ,0,0,False,{},,259855,,79900,,84474
55019,3962917,HP 202A Yellow LaserJet Toner Cartridge,Hp,CF502A,86.18,30,Suministros y Medios,Suministros Láser,ok,False,0,0,0,Toner Original HP 202A Amarillo,0,0,False,{},,259853,,93500,,103071
50746,4050457,TINTA HP 730 300 ML CIAN,Hp,P2V68A,155.91,6,Suministros y Medios,Suministros Inyección de Tinta,ok,False,0,0,0,Cartucho de Tinta Original HP 730 Cyan / 300ml,0,0,False,{},,261555,,175880,,190518
44748,4084653,200 AZUL INALAMBRICO MOUSE,Hp,2HU85AA#ABL,9.47,810,Dispositivos de Entrada,Mouse,ok,False,0,0,0,Mouse Inalámbrico HP 200 - Azul,0,0,False,{},,,,,,
50751,4050460,TINTA HP 730 300 ML MATE NEGRO,Hp,P2V71A,155.56,28,Suministros y Medios,Suministros Inyección de Tinta,ok,False,0,0,0,Cartucho de Tinta Original HP 730 Negro Matte/ 300ml,0,0,False,{},,260167,,175637,,189904
50753,4050462,TINTA HP 730 300 ML FOTO NEGRO,Hp,P2V73A,156.11,2,Suministros y Medios,Suministros Inyección de Tinta,ok,False,0,0,0,Cartucho de Tinta Original HP 730 Negro Fotográfico/ 300ml,0,0,False,{},,260061,,,,
55864,4255929,POWER SUPPLY-100-240 VAC,Zebra,PWR-WUA5V12W0US,13.73,24,Componentes de Sistema,Fuentes de Poder para Computadores Espec,ok,False,0,0,0,Fuente de alimentación 100-240 VAC,0,0,False,{},,,,,,
56545,4485251,APC Smart-UPS SRT 1000VA 230V,Apc,SRT1000XLI,1257.6,1,Protección Eléctrica y Racks,UPS,ok,False,0,0,0,APC Smart-UPS SRT 1000VA 230V,0,0,False,{},,150693,,1235504,,1345869
