pcf_id,ingram_part,description,vendor_name,vendor_part,customer_price,available_qty,category,subcategory,api_status,mayorista,lista,stock_pcf,stock_raw,nombre_pcf,precio_normal,precio_oferta,ficha_vacia,stock_detail,error,solotodo_id,pcf_price,min_price,mode_price,mean_price
54709,6643298,IMPRESORA IMAGEPROGRAF TC-21,Canon,7055C002,661.25,23,Impresoras,Plotters color,ok,False,1,1,1,"Plotter 24"" ImagePROGRAF TC-21 USB/ Ethernet ",0,0,False,{},,355694,,719900,,740089
55913,6642874,GEFORCE RTX 3050 VENTUS 2X 6G OC,Msi,912-V812-060,233.38,14,Componentes de Sistema,Tarjetas Gráficas nVidia,ok,False,1,5,5,Tarjeta de Video NVIDIA GEFORCE RTX 3050 VENTUS 2X 6G OC,0,0,False,{},,,,,,
54594,6648757,PRIME-B760M-A LGA1700 MB,Asus,90MB1EK0-M1EAY0,109.07,322,Componentes de Sistema,Tarjetas Madre Intel,ok,False,1,50,+50,Placa Madre Intel PRIME B760M-A,0,0,False,{},,,,,,
44748,6644606,HP 200 MRN BLUE WIRELESS MOUSE,Hp,2HU85AA#ABL,7.9,508,Dispositivos de Entrada,Mouse,ok,False,1,2,2,Mouse Inalámbrico HP 200 - Azul,0,0,False,{},,,,,,
55314,6650021,24IN FULL HD 120HZ MONITOR WITH BUILT-IN,Viewsonic,VA2456A-MHD,73.21,1819,Pantallas,Monitores LCD/LED,ok,False,1,100,+100,"Monitor ViewSonic 24"" FHD, 120HZ, VGA, DP, HDMI, VA2456A-MHD",0,0,False,{},,,,,,
44746,6644607,HP WIRED MOUSE 100 LTNA,Hp,6VY96AA#ABM,3.86,1730,Equipamiento de Oficina,"Mousepads, Apoyamuñecas y Descanso",ok,True,0,100,+100,Mouse Wired 100 Cable USB Negro ,0,0,False,{},,,,,,
54777,6650362,HERO13 Black Extended Power Bundle,Gopro,CHDRB-134-RW,438.44,372,Cámaras y Escáners,Cámaras de Video Digital,ok,False,1,3,3,Cámara Hero13 Black Extended Power Bundle,0,0,False,{},,,,,,
54339,6674284,MONITOR LG CURVO 24 INCHES FHD 100HZ 5MS,Lg,24U421A-B.AWHQ,76.88,81,Pantallas,Monitores LCD/LED,ok,False,1,100,+100,"Monitor LG Curvo 24"", FHD, 100Hz, 5ms, USB-C, 24U421A-B",0,0,False,{},,,,,,
54618,6685194,MICROFONO QUADCAST 2 NEGRO,Hp,872V1AA,117.19,20,Dispositivos Audio/Video,Micrófonos para PCs,ok,False,1,24,24,Micrófono Gamer HyperX QuadCast 2 - Negro,0,0,False,{},,,,,,
51466,6685186,MICROFONO USB NEGRO SOLOCAST,Hp,4P5P8AA,57.79,8,Dispositivos Audio/Video,Micrófonos para PCs,ok,False,1,11,11,Micrófono Gamer HyperX SoloCast Black,0,0,False,{},,,,,,
54883,6681009,CAMARA GOPRO MAX 2,Gopro,CHDHZ-311-RW,454.16,169,Cámaras y Escáners,Cámaras de Video Digital,ok,False,1,6,6,Cámara GoPro MAX 2 360 Black,0,0,False,{},,,,,,
55026,6681010,CAMARA GOPRO LIT FRACTION,Gopro,CHDHF-132-AT,275.27,58,Cámaras y Escáners,Cámaras de Video Digital,ok,False,1,1,1,Cámara GoPro LIT HERO,0,0,False,{},,,,,,
54806,6694378,ECOTANK L4360 IMPRESORA MULTIFUNCIONAL A,Epson,C11CL41303,238.51,378,Impresoras,Multifuncionales Láser Color,ok,False,1,100,+100,Multifuncional Tinta Continua EcoTank L4360 WiFi-Direct/ Dúplex automático ,0,0,False,{},,358396,259990,202850,249990,244009
54865,6705812,PROYECTOR EPSON POWERLITE E24,Epson,V11HB51021,413.51,88,Dispositivos Audio/Video,Proyectores LCD,ok,False,1,50,+50,Proyector Powerlite E24,0,0,False,{},,360265,499990,443177,,469307
56366,6708599,240 G10 I3 100U 8GB 256GB 14IN W11H,Hp,C7GR2AT#ABM,482.08,305,Computadores Servidores y Notebooks,Notebooks,ok,True,0,100,+100,"Notebook 240 G10 Intel Core i3-100U 8GB RAM 256GB SSD 14"" Windows 11 Home C7GR2AT#ABM",0,0,False,{},,,,,,
55093,6718537,MONITOR LG 27G411A-B 27in FHD 144Hz,Lg,27G411A-B.AWH,98.24,47,Pantallas,Monitores LCD/LED,ok,False,1,12,12,"Monitor Gamer LG 27"" FHD, 144 Hz, IPS, 27G411A-B.AWH",0,0,False,{},,,,,,
56344,6749911,HP ProStudio 4 AiO G1i-CU7-24GB-1TB-W11P,Hp,CL7U6LT#ABM,1012.4,89,Computadores Servidores y Notebooks,Computadores con Monitor integrado,ok,True,0,50,+50,"All In One HP Pro Studio 4 G1 23.8"" Intel Ultra 7 265T 24GB RAM 1TB SSD Windows 11 Pro",0,0,False,{},,,,,,
56367,6738299,240 G9 I3 100U 8GB 256 SSD FREEDOS,Hp,D14FJAT#AKH,431.27,305,Computadores Servidores y Notebooks,Notebooks,ok,True,0,100,+100,Notebook 240 G9 Intel Core 100U 8GB RAM 256GB SSD FREEDOS D14FJAT#AKH,0,0,False,{},,,,,,
56343,6749915,HP ProStudio 4 AiO G1i-CU5-24GB-512GB-W1,Hp,CL7U5LT#ABM,871.33,116,Computadores Servidores y Notebooks,Computadores con Monitor integrado,ok,True,0,100,+100,All in One HP Pro Studio 4 G1 23.8” Ultra 5 225T 24GB 512GB SSD Windows 11 Pro,0,0,False,{},,,,,,
53103,6751723,MOCHILA GRIS 16IN SP LITE,Kensington,K60398WW,13.05,227,Computadores Servidores y Notebooks,Bolsos y Mochilas p/Notebooks,ok,False,1,30,+30,"Mochila para Notebook Simply Portable Waterproof 16"" - Gris",0,0,False,{},,,,,,
55799,6779529,SMART TV LG 65IN QNED AI 4K,Lg,65QNED73ASA.AWH,526.68,144,Pantallas,TV LCD/LED,ok,False,1,14,14,"Smart TV LG 65"" QNED73ASA.AWH",0,0,False,{},,,,,,
55306,6783816,Monitor Samsung Odyssey G5 32IN IPS QHD,Samsung,LS32FG500ELXZS,229.28,54,Pantallas,Monitores LCD/LED,ok,False,1,50,+50,"Monitor Gamer Samsung 32"", QHD, 180Hz, VA, 1ms, HDR10, FreeSync, Odyssey G5 LS32FG500ELXZS",0,0,False,{},,368697,281290,238440,,260614
55305,6783817,Monitor Samsung Smart M5 27IN VA FHD,Samsung,LS27FM501ELXZS,160.5,35,Pantallas,Monitores LCD/LED,ok,False,1,6,6,"Monitor Smart Samsung 27"", FHD, 60Hz , VA, 4ms, HDR, LS27FM501ELXZS",0,0,False,{},,379069,182990,182990,,193973
56195,6783814,Monitor Gamer Samsung Odyssey G5 27IN QH,Samsung,LS27FG500ELXZS,194.89,100,Pantallas,Monitores LCD/LED,ok,False,1,50,+50,"Monitor Gamer Samsung 27"" QHD, 180Hz, Odyssey G5 G50F, LS27FG500ELXZS",0,0,False,{},,384137,214990,199990,199990,206783
56196,6783819,Monitor Samsung Odyssey G6 27IN QHD,Samsung,LS27FG602ELXZS,378.32,50,Pantallas,Monitores LCD/LED,ok,False,1,21,21,"Monitor Gamer Samsung 27"" QHD, 350Hz, Odyssey G6 G60F, LS27FG602ELXZS",0,0,False,{},,369294,399990,389990,,504561
54390,6783820,Monitor Samsung S8 37IN VA 4K UHD,Samsung,LS37D800UALXZS,378.32,30,Pantallas,Monitores LCD/LED,ok,False,1,3,3,"Monitor Samsung ViewFinity S8 37"" ",0,0,False,{},,274084,444990,424990,424990,446183
55624,6784292,PRIME H610M-K,Asus,90MB1GA0-MVAAY0,73.63,190,Componentes de Sistema,Tarjetas Madre Intel,ok,False,1,29,29,Placa Madre PRIME H610M-K,0,0,False,{},,,,,,
56199,6785317,ADATA DDR5 U-DIMM 8GB 5600 SINGLE TRAY,Adata Technology,AD5U56008G-S,179.2,390,Componentes de Sistema,Memoria Genérica,ok,True,0,100,+100,Memoria RAM Notebook DDR5 8GB 5600 MHz UDIMM Single TRAY,0,0,False,{},,201336,,99740,,163545
56198,6785316,ADATA DDR5 U-DIMM 8GB 5600 WHITE,Adata Technology,AX5U5600C468G-SLABWH,189.69,200,Componentes de Sistema,Memoria Genérica,ok,True,0,100,+100,Memoria RAM Notebook DDR5 8GB 5600 MHz UDIMM WHITE,0,0,False,{},,382834,,167500,,185981
56269,6791899,MAG A1000GLS PCIE5,Msi,306-7ZPIX23-CE0,103.13,184,Componentes de Sistema,Fuentes de Poder Genéricas,ok,True,0,100,+100,MAG A1000GLS PCIE5,0,0,False,{},,,,,,
56369,6805745,NB TP L14 AMD G4 R7_PRO 16G 512G 11P,Lenovo,21H6S58W00,961.9,77,Computadores Servidores y Notebooks,Notebooks,ok,True,0,50,+50,Notebook ThinkPad L14 Gen 4 AMD Ryzen 7 PRO 7730U 16GB RAM 512GB SSD Windows 11 Pro,0,0,False,{},,388675,,1066818,,1089578
56103,6804958,27IN Odyssey G5 G53F QHD 200Hz Panel IPS,Samsung,LS27FG530ELXZS,155.91,330,Pantallas,Monitores LCD/LED,ok,False,1,23,23,"Monitor Gamer Samsung 27"", QHD, 200Hz, IPS, 1ms, HDR10, FreeSync, Odyssey G5 LS27FG530ELXZS",0,0,False,{},,367652,193990,179990,,189405
