pcf_id,ingram_part,description,vendor_name,vendor_part,customer_price,available_qty,category,subcategory,api_status,mayorista,lista,stock_pcf,stock_raw,nombre_pcf,precio_normal,precio_oferta,ficha_vacia,stock_detail,error,solotodo_id,pcf_price,min_price,mode_price,mean_price
52383,5855590,MONITOR LS34C500GA PLANO 3440X1440 VA,Samsung,LS34C500GALXZS,222.82,1,Pantallas,Pantallas Comerciales LCD/LED,ok,False,1,5,5,"Monitor Samsung 34"", WQHD, 100Hz, Va, Freesync, ViewFinity S5, LS34C500GALXZS",0,0,False,{},,211022,284990,259616,,282885
50261,5889079,PIXMA G3170 BLACK USB WIFI,Canon,5805C005,162.0,69,Impresoras,Multifuncionales Inkjet,ok,False,1,50,+50,Multifuncional Tinta Continua Pixma G3170 WiFi,0,0,False,{},,216635,164990,144990,174990,173553
52558,5914217,Back-UPS Connect UPS de 12 V CC con bate,Apc,CP12036LI,47.45,60,Protección Eléctrica y Racks,UPS,ok,False,1,2,2,UPS 12Vdc 36W SAI Back-UPS Connect  para Routers,0,0,False,{},,261792,64990,49856,,64555
49621,5917221,EPIQVISION FH02,Epson,V11HA85020,607.93,231,Dispositivos Audio/Video,Proyectores LCD,ok,False,1,30,+30,Proyector Portátil Smart Epson Epiqvision CO-FH02,0,0,False,{},,236816,,489900,,660533
50260,5999348,PIXMA G2170 BLACK USB,Canon,5804C005,145.29,81,Impresoras,Impresoras de Inyección de Tinta,ok,False,0,1,1,Multifuncional Tinta Continua Pixma G2170 ,0,0,False,{},,218645,,129990,,160577
36122,6069363,HUB PORTABLE USB 2.0 K39120,Kensington,K39120,8.36,52,Dispositivos de Entrada/Salida,Conmutadores para dispositivos USB,ok,False,1,100,+100,HUB USB 2.0 4 Puertos UH4000,0,0,False,{},,,,,,
41441,6110755,KEYBOARD WIRELESS COMPACT K75502ES,Kensington,K75502ES,19.43,19,Dispositivos de Entrada,Teclados,ok,False,1,100,+100,Teclado Compacto Multidispositivo Inalámbrico Dual Wireless Bluetooth Negro,0,0,False,{},,112914,24990,14990,28004,24821
51135,6110314,ALUMINUM NOTEBOOK BASE K50406WW,Kensington,K50406WW,16.14,33,Computadores Servidores y Notebooks,Dockings y Pedestales p/Notebooks,ok,False,1,100,+100,"Base para Notebook Metálica Plegable (K50406) hasta 16"" - Negro",0,0,False,{},,,,,,
51489,6114116,RYZEN 5 8500G AI 5.00GHZ 6 CORE SKT AM5,Amd,100-100000931BOX,137.19,92,Componentes de Sistema,Procesadores AMD,ok,False,1,15,15,CPU AMD Ryzen 5 8500G (AM5),0,0,False,{},,232385,159990,146390,146390,163898
51417,6119329,CAMPUS XL MARBLE STONE BACKPACK 20L,Hp,7J592AA,24.0,24,Computadores Servidores y Notebooks,Bolsos y Mochilas p/Notebooks,ok,False,1,2,2,"Mochila para Notebooks Stone 16.1"" - Negro Mármol",0,0,False,{},,,,,,
50264,6123435,TECLADO INALAMBRICO COMPACTO K75504ES,Kensington,K75504ES,19.43,38,Dispositivos de Entrada,Combos Teclado/Mouse,ok,False,1,50,+50,Teclado Compacto Multidispositivo Inalámbrico Dual Wireless Bluetooth Blanco,0,0,False,{},,148017,24990,22273,,24521
52033,6159736,BASE MONITOR METAL EXTRA LONG K58305,Kensington,K58305,11.6,43,Pantallas,"Brazos, Pedestales, Montaje p/Monitores",ok,False,1,50,+50,"Base para Monitor Extra Larga metal hasta 34""",0,0,False,{},,,,,,
53448,6213555,16-R1015LA I7 16GB1TBSSD8V RTX4060,Hp,A14LXLA#ABM,1323.5,89,Computadores Servidores y Notebooks,Notebooks,ok,False,1,1,1,"Notebook Gamer Victus 16-r1015la Intel Core i7-14650H NVIDIA GeForce RTX 4060 16.1"" FHD 144Hz 16GB RAM 1TB SSD Windows 11 Home Gris A14LXLA#ABM",0,0,False,{},,,,,,
52211,6209667,LED MONITOR VA220-H 22IN FULL HD 250NITS,Viewsonic,VA220-H,55.64,667,Pantallas,Monitores LCD/LED,ok,False,1,100,+100,"Monitor Viewsonic 22"" FHD, 100Hz, VA, 1ms, VA220-H",0,0,False,{},,,,,,
52801,6261606,RYZEN 7 9700X 8-CORE PROCESSOR,Amd,100-100001404WOF,336.24,39,Componentes de Sistema,Procesadores AMD,ok,False,1,12,12,CPU AMD Ryzen 7 9700X (AM5),0,0,False,{},,252399,379990,350190,358990,376113
52800,6261610,RYZEN 5 9600X 6-CORE PROCESSOR,Amd,100-100001405WOF,229.31,61,Componentes de Sistema,Procesadores AMD,ok,True,0,50,+50,CPU AMD Ryzen 5 9600X (AM5),0,0,False,{},,252401,,213540,,246775
52802,6261609,RYZEN 9 9900X 12-CORE PROCESSOR,Amd,100-100000662WOF,415.24,16,Componentes de Sistema,Procesadores AMD,ok,False,1,6,6,CPU AMD Ryzen 9 9900X (AM5),0,0,False,{},,252400,469990,443990,499900,477974
36215,6291140,200 WIRELESS BLACK MOUSE,Hp,X6W31AA#ABL,7.89,2429,Dispositivos de Entrada,Mouse,ok,False,1,100,+100,Mouse Inalámbrico HP 200  - Negro,0,0,False,{},,,,,,
53569,6278432,BASE NOTEBOOK EASY RISER K52805WW,Kensington,K52805WW,13.35,124,Computadores Servidores y Notebooks,Dockings y Pedestales p/Notebooks,ok,False,1,100,+100,"Base para Notebook Easy Riser EQ SmartFit hasta 17"" - Negro",0,0,False,{},,,,,,
44635,6291422,LAPTOP SLV PROT REV 14 BLK/BLU,Hp,2F1X4AA,8.23,2002,Computadores Servidores y Notebooks,Bolsos y Mochilas p/Notebooks,ok,False,1,50,+50,"Funda Protectora Reversible para Notebook 14"" Negro/Azul",0,0,False,{},,,,,,
53859,6292201,GOPRO-Twin Pack Battery,Gopro,AEBAT-201,34.06,85,Cámaras y Escáners,Opciones de Energía para Cámaras,ok,False,1,15,15,Pack 2 Baterías Recargables Enduro para HERO13 Black,0,0,False,{},,,,,,
52971,6291554,VELOP MICRO-ROUTER MICRO MESH 6,Linksys,LN11011201,171.49,2,Dispositivos de Red,Routers y Gateways inalámbricos,ok,False,1,2,2,Micro Router Linksys & 1x Micro Mesh WiFi 6 AX 3000,0,0,False,{},,369215,249990,194900,,206143
53860,6292209,GOPRO-Standalone Battery,Gopro,AEBAT-001,20.43,82,Cámaras y Escáners,Opciones de Energía para Cámaras,ok,False,1,21,21,Batería Recargable Enduro para HERO13 Black,0,0,False,{},,,,,,
53178,6294940,MONITOR LS24D600UA 2560x1440 IPS USB-C,Samsung,LS24D600UALXZS,200.42,36,Pantallas,Monitores LCD/LED,ok,False,1,30,+30,"Monitor Samsung 24"", QHD, 100Hz, IPS, 5ms, ViewFinity S6 LS24D600UALXZS",0,0,False,{},,246825,269990,223099,309990,260508
52632,6292516,WIRELESS MICRO ROUTER AC1200,Linksys,LN3101-LA,26.84,19,Dispositivos de Red,Componentes para Router,ok,False,1,50,+50,Micro Router Linksys LN3101 WiFi 5 AC1200 Dual Band,0,0,False,{},,369208,44990,29792,,37984
52689,6294951,MONITOR LS27D700EAL 4K 3840x2160 IPS,Samsung,LS27D700EALXZS,227.47,41,Pantallas,Monitores LCD/LED,ok,False,1,100,+100,"Monitor Samsung 27"", 4K, 60Hz, IPS, 5ms, HDR10, ViewFinity S7 LS27D700EALXZS",0,0,False,{},,246833,279990,249990,,284985
54241,6315076,CRUCIAL T500 500GB PCIE GEN4 NVME M.2 SS,Crucial,CT500T500SSD8,153.0,4,Dispositivos de Almacenamiento,Discos de Estado Sólido PCIe (SSD),ok,False,1,50,+50,Unidad SSD T500 500GB PCIe Gen4 NVMe M.2,0,0,False,{},,254708,139990,139990,,164018
54618,6325277,MICROFONO QUADCAST 2 NEGRO,Hp,872V1AA,86.82,333,Dispositivos Audio/Video,Micrófonos para PCs,ok,False,1,23,23,Micrófono Gamer HyperX QuadCast 2 - Negro,0,0,False,{},,,,,,
52514,6326048,EarPods (USB-C),Apple,MYQY3AM/A,16.46,192,Comunicaciones,Cintillos telefónicos,ok,False,1,3,3,Audífonos EarPods USB-C Apple,0,0,False,{},,264934,,9990,,20164
54661,6315171,LOQ GEN9 I5 16GB 512SSD W11H,Lenovo,83GS00G8CL,747.79,67,Computadores Servidores y Notebooks,Notebooks,ok,False,1,2,2,"Notebook Gamer LOQ Gen 9 Intel Core i5-12450HX NVIDIA GeForce RTX 3050 15.6"" FHD 144Hz 16GB RAM 512GB SSD Windows 11 Home Luna Grey 83GS00G8CL",0,0,False,{},,254636,824490,814990,,857617
52121,6324674,GOPRO CAMARA HERO FRACTION,Gopro,CHDHF-131-AS,193.07,201,Cámaras y Escáners,Cámaras de Video Digital,ok,False,1,5,5,Cámara Hero Black,0,0,False,{},,,,,,
54989,6327493,PRIME A620M-K,Asus,90MB1F40-M0EAY0,72.43,526,Componentes de Sistema,Tarjetas Madre AMD,ok,False,1,50,+50,Placa Madre AMD PRIME A620M-K (sAM5),0,0,False,{},,,,,,
54593,6338363,TUF GAMING X870-PLUS WIFI,Asus,90MB1IU0-M0EAY0,282.15,60,Componentes de Sistema,Tarjetas Madre Intel,ok,False,1,19,19,Placa Madre  AMD Asus TUF GAMING X870-PLUS WIFI (sAM5),0,0,False,{},,,,,,
52955,6338369,MONITOR LS32D700EAL 4K 3840X2160 IPS,Samsung,LS32D700EALXZS,261.83,36,Pantallas,Monitores LCD/LED,ok,False,1,23,23,"Monitor Samsung 32"", UHD, 60Hz, VA, 5ms, ViewFinity S7 LS32D700EALXZS",0,0,False,{},,246834,314990,299910,,315555
47902,6341651,HP MOUSE INALAMBRICO 150 NEGRO,Hp,2S9L1AA#ABM,9.32,401,Dispositivos de Entrada,Mouse,ok,False,1,50,+50,Mouse Inalámbrico HP 150 - Negro,0,0,False,{},,,,,,
54823,6341225,MEMORIA 32GB DDR5 5600 SODIMM,Crucial,CT32G56C46S5,370.23,150,Impresoras,Memoria para Impresoras,ok,False,1,13,13,Memoria RAM Notebook 32GB DDR5-5600 SODIMM CL46 (16Gbit),0,0,False,{},,256907,339990,334400,339990,384386
47619,6341650,HP MOCHILA PRELUDE 15.6IN GRIS,Hp,2Z8P3AA,12.43,575,Computadores Servidores y Notebooks,Bolsos y Mochilas p/Notebooks,ok,False,1,30,+30,"Mochila Prelude G2 15.6"" Gris",0,0,False,{},,,,,,
52687,6359937,MONITOR LS27DG300ELXZS,Samsung,LS27DG300ELXZS,113.84,54,Pantallas,Monitores LCD/LED,ok,False,1,100,+100,"Monitor Gamer Samsung 27"", FHD, 180Hz, VA, 1ms, FreeSync, Odyssey G3 LS27DG300ELXZS",0,0,False,{},,253813,139990,118500,179990,151191
47617,6341653,HP TECLADO INALAMBRICO COMPACTO 350,Hp,692S8AA#ABM,18.96,1095,Dispositivos de Entrada,Teclados,ok,False,1,100,+100,Teclado Inalámbrico HP 350 Compact Multi-Device - Negro,0,0,False,{},,,,,,
53197,6379930,BOTELLA DE TINTA AMARILLA BTD100Y,Brother,BTD100Y,6.86,263,Suministros y Medios,Suministros Inyección de Tinta,ok,False,1,100,+100,Botella de Tinta Original Brother BTD100Y Amarillo,0,0,False,{},,259758,8990,7543,9990,9525
53196,6379932,BOTELLA DE TINTA MAGENTA BTD100M,Brother,BTD100M,6.86,298,Suministros y Medios,Suministros Inyección de Tinta,ok,False,1,100,+100,Botella de Tinta Original Brother BTD100M Magenta,0,0,False,{},,259755,8990,7543,9990,9478
53195,6379933,BOTELLA DE TINTA CIAN BTD100C,Brother,BTD100C,6.86,353,Suministros y Medios,Suministros Inyección de Tinta,ok,False,1,100,+100,Botella de Tinta Original Brother BTD100C Cyan,0,0,False,{},,259756,8990,7543,9990,9321
44636,6406894,HP FUNDA REVERSIBLE 15IN NEGRO AZUL,Hp,2F1X7AA,8.44,295,Computadores Servidores y Notebooks,Bolsos y Mochilas p/Notebooks,ok,False,1,50,+50,"Funda Protectora Reversible para Notebook 15.6"" Negro/Azul",0,0,False,{},,,,,,
53194,6379940,MULTIFUNCIONAL DCP-T930DW,Brother,MFCT930DW,289.61,8,Impresoras,Multifuncionales Inkjet,ok,False,1,50,+50,Multifuncional Tinta Continua InkBenefit Tank MFCT930DW Direct/Dúplex,0,0,False,{},,260839,259990,199990,,282721
54201,6417090,YOGA SNAPDRAGON 8 G3 16GB 256GB 12.7IN,Lenovo,ZAEG0024CL,560.03,97,Computadores Servidores y Notebooks,Tablets y Tablet PCs,ok,False,1,4,4,"Tablet Yoga Tab Plus 12,7"" 16GB 256GB Wi-Fi Octa Core Azul + Teclado + Funda + Lápiz",0,0,False,{},,,,,,
55675,6456329,CLOUD JET AURICULARES GAMING INALAMBRICO,Hp,AJ0T1AA,36.53,6,Dispositivos Audio/Video,Cintillos y Audífonos para PCs,ok,False,1,13,13,Audífonos Gamer Hyper X Cloud Jet Wireless Negro,0,0,False,{},,364132,47990,38990,,44295
53913,6417091,LEGION SNAPDRAGON 8 G3 12GB 256GB 8.8IN,Lenovo,ZAEF0041CL,425.56,622,Computadores Servidores y Notebooks,Tablets y Tablet PCs,ok,False,1,5,5,"Tablet Gamer Legion Tab Qualcomm Snapdragon 8 Gen 3 8.8"" QHD 12GB 256GB WiFi Octa Core Android Negro + Funda",0,0,False,{},,265288,465590,439990,499990,491571
53808,6457292,IDEAPAD 3 G8 R7 5825U 16GB 512GB 15.6IN,Lenovo,82XM00M4CL,705.8,500,Computadores Servidores y Notebooks,Notebooks,ok,False,1,100,+100,"Notebook Ideapad Slim 3 Gen 8 AMD Ryzen 7 5825U 15.6"" FHD 60Hz 16GB 512GB Windows 11 Home Azul 82XM00M4CL",0,0,False,{},,269594,669990,609990,,680972
53809,6457293,IDEAPAD 3 G10 I5 13420H 16GB 1TB 15.3IN,Lenovo,83K100BWCL,642.9,485,Computadores Servidores y Notebooks,Notebooks,ok,False,1,3,3,"Notebook Ideapad Slim 3 Intel Core i5-13420H 15.3"" WUXGA Touch 60Hz 16GB 1TB SSD Windows 11 Gris 83K100BWCL",0,0,False,{},,269700,727490,689990,729990,722558
55626,6500385,GeForce RTX 5070 12G SHADOW 2X OC,Msi,912-V532-011,658.89,31,Video Juegos y Consolas,Otros Accesorios para Videojuegos,ok,False,1,24,24,Tarjeta de Video NVIDIA GeForce RTX 5070 12G SHADOW 2X OC,0,0,False,{},,271979,709990,698630,718990,739661
49077,6486381,LG XBOOM RNC5 SOUND BAR,Lg,RNC5.DCHLLLK,158.37,352,Dispositivos Audio/Video,Parlantes y Subwoofers Entretención/Pro,ok,False,1,16,16,Torre de Sonido LG XBOOM RNC5,0,0,False,{},,,,,,
53700,6501044,MONITOR 34 IN ODYSSEY OLED G8,Samsung,LS34DG850SLXZS,887.92,1,Pantallas,Monitores LCD/LED,ok,False,1,4,4,"Monitor Samsumg Curvo 34"", UWQHD, Panel OLED, 0.03ms, HDR10, Odyssey G8, LS34DG850SLXZS",0,0,False,{},,261783,979690,898393,,1018528
53865,6501042,Monitor Essential 24 S3 S24D300GAL,Samsung,LS24D300GALXZS,72.13,34,Pantallas,Monitores LCD/LED,ok,False,1,100,+100,"Monitor Samsung 24"", FHD, 100Hz, IPS, 5ms, Essential S3 LS24D300GALXZS",0,0,False,{},,265684,96990,81990,139990,96398
55430,6500388,GeForce RTX 5070 12G VENTUS 2X OC,Msi,912-V532-009,681.82,48,Video Juegos y Consolas,Otros Accesorios para Videojuegos,ok,False,1,23,23,Tarjeta de Video NVIDIA Geforce RTX  5070 12G Ventus 2X OC,0,0,False,{},,271705,829990,709990,749900,791224
54152,6509276,CAMARA MAX 360,Gopro,CHDHZ-203-RW,321.02,284,Cámaras y Escáners,Cámaras de Video Digital,ok,False,1,4,4,Cámara GoPro MAX 360 Black,0,0,False,{},,,,,,
48503,6567740,MOUSE INALAMBRICO GAMING,Hp,6N0B0AA,52.08,40,Dispositivos de Entrada,Mouse,ok,False,1,26,26,Mouse Gamer Inalámbrico HyperX Pulsefire Haste 2 - Negro,0,0,False,{},,226714,69990,44990,,61740
55843,6590147,YOGA SLIM 7 10GEN CORE ULTRA7 32GB 1TB,Lenovo,83JX002VCL,1131.9,21,Computadores Servidores y Notebooks,Notebooks,ok,False,1,50,+50,"Notebook Yoga Slim 7 Gen 10 Intel Core Ultra 7 14"" OLED 120Hz 32GB 1TB Windows 11 Home 83JX002VCL",0,0,False,{},,274067,1299990,1249900,1299990,1286700
54389,6589745,MONITOR GAMING ODYSSEY G7 DE 27 IN,Samsung,LS27DG700ELXZS,371.94,52,Pantallas,Monitores LCD/LED,ok,False,1,12,12,"Monitor Gamer Samsung 27""  4K,144Hz, Fast IPS, 1ms, HDR10+, Odyssey G7 G70D",0,0,False,{},,271820,489990,436990,519990,477995
47616,6585365,MOUSE INALÁMBRICO MULTI 430,Hp,3B4Q2AA#ABL,17.69,61,Dispositivos de Entrada,Mouse,ok,False,1,50,+50,Mouse Inalámbrico HP 430 Multi-Device - Negro,0,0,False,{},,,,,,
53891,6598977,X1605VA MB205W i9 13900H 16 512 UMA 16IN,Asus,90NB10N3-M01B40,890.72,102,Computadores Servidores y Notebooks,Notebooks,ok,False,1,9,9,"Notebook Vivobook 16 Intel Core i9-13900H 16.0"" WUXGA 60Hz 16GB 512GB Windows 11 Home Negro X1605VA-MB205W",0,0,False,{},,272618,872990,839990,,944533
54388,6604497,MONITOR SAMSUNG LS27F320GALXZS,Samsung,LS27F320GALXZS,104.64,130,Pantallas,Monitores LCD/LED,ok,False,1,100,+100,"Monitor Samsung 27"" FHD, 120Hz, IPS, Essential S3, LS27F320GALXZS",0,0,False,{},,276533,112990,94740,,108767
54819,6626609,MONITOR 32U631A-B 2560X1440 IPS 31.5PULG,Lg,32U631A-B.AWHQ,214.82,216,Pantallas,Monitores LCD/LED,ok,False,1,2,2,"Monitor LG 32"" QHD IPS 100Hz HDMI USB-C VESA",0,0,False,{},,,,,,
54391,6604498,MONITOR SAMSUNG ESSENTIAL LS22D300GALXZS,Samsung,LS22D300GALXZS,58.64,22,Pantallas,Monitores LCD/LED,ok,False,1,100,+100,"Monitor Samsung 22"", FHD, Panel IPS, Essential S3 100 Hz, 5ms LS22D300GALXZS",0,0,False,{},,274200,79990,65900,99990,80939
55061,6638426,MONITOR GAMINGVX2729 27IN 200HZ FHD,Viewsonic,VX2729,104.93,34,Pantallas,Monitores LCD/LED,ok,False,1,100,+100,"Monitor Gamer ViewSonic, 27"", FHD, 200Hz,, Fast IPS 1ms, Free Sync Premium, VX2729   ",0,0,False,{},,364178,134990,112890,,125902
44748,6644606,HP 200 MRN BLUE WIRELESS MOUSE,Hp,2HU85AA#ABL,7.9,502,Dispositivos de Entrada,Mouse,ok,False,1,2,2,Mouse Inalámbrico HP 200 - Azul,0,0,False,{},,,,,,
55913,6642874,GEFORCE RTX 3050 VENTUS 2X 6G OC,Msi,912-V812-060,233.38,14,Componentes de Sistema,Tarjetas Gráficas nVidia,ok,False,1,1,1,Tarjeta de Video NVIDIA GEFORCE RTX 3050 VENTUS 2X 6G OC,0,0,False,{},,,,,,
55314,6650021,24IN FULL HD 120HZ MONITOR WITH BUILT-IN,Viewsonic,VA2456A-MHD,73.21,1681,Pantallas,Monitores LCD/LED,ok,False,1,100,+100,"Monitor ViewSonic 24"" FHD, 120HZ, VGA, DP, HDMI, VA2456A-MHD",0,0,False,{},,,,,,
54594,6648757,PRIME-B760M-A LGA1700 MB,Asus,90MB1EK0-M1EAY0,105.59,321,Componentes de Sistema,Tarjetas Madre Intel,ok,False,1,50,+50,Placa Madre Intel PRIME B760M-A (s1700),0,0,False,{},,,,,,
54777,6650362,HERO13 Black Extended Power Bundle,Gopro,CHDRB-134-RW,433.13,372,Cámaras y Escáners,Cámaras de Video Digital,ok,False,1,3,3,Cámara Hero13 Black Extended Power Bundle,0,0,False,{},,,,,,
55026,6681010,CAMARA GOPRO LIT FRACTION,Gopro,CHDHF-132-AT,271.95,58,Cámaras y Escáners,Cámaras de Video Digital,ok,False,1,1,1,Cámara GoPro LIT HERO,0,0,False,{},,,,,,
54339,6674284,MONITOR LG CURVO 24 INCHES FHD 100HZ 5MS,Lg,24U421A-B.AWHQ,101.52,128,Pantallas,Monitores LCD/LED,ok,False,1,100,+100,"Monitor LG Curvo 24"", FHD, 100Hz, 5ms, USB-C, 24U421A-B",0,0,False,{},,,,,,
54883,6681009,CAMARA GOPRO MAX 2,Gopro,CHDHZ-311-RW,448.68,169,Cámaras y Escáners,Cámaras de Video Digital,ok,False,1,6,6,Cámara GoPro MAX 2 360 Black,0,0,False,{},,,,,,
51466,6685186,MICROFONO USB NEGRO SOLOCAST,Hp,4P5P8AA,57.79,7,Dispositivos Audio/Video,Micrófonos para PCs,ok,False,1,11,11,Micrófono Gamer HyperX SoloCast Black,0,0,False,{},,,,,,
54618,6685194,MICROFONO QUADCAST 2 NEGRO,Hp,872V1AA,117.19,20,Dispositivos Audio/Video,Micrófonos para PCs,ok,False,1,23,23,Micrófono Gamer HyperX QuadCast 2 - Negro,0,0,False,{},,,,,,
54806,6694378,ECOTANK L4360 IMPRESORA MULTIFUNCIONAL A,Epson,C11CL41303,235.62,346,Impresoras,Multifuncionales Láser Color,ok,False,1,100,+100,Multifuncional Tinta Continua EcoTank L4360 WiFi-Direct/ Dúplex automático ,0,0,False,{},,358396,259990,202850,249990,249428
54865,6705812,PROYECTOR EPSON POWERLITE E24,Epson,V11HB51021,408.51,50,Dispositivos Audio/Video,Proyectores LCD,ok,False,1,50,+50,Proyector Powerlite E24,0,0,False,{},,360265,499990,443655,,474937
55091,6710569,22U401A MONITOR FHD 21.5 100HZ,Lg,22U401A-B.AWHQ,76.98,599,Pantallas,Monitores LCD/LED,ok,False,1,100,+100,"Monitor LG 22"" FHD, 100Hz, VA, 22U401A-B.AWHQ",0,0,False,{},,,,,,
55093,6718537,MONITOR LG 27G411A-B 27in FHD 144Hz,Lg,27G411A-B.AWH,100.25,46,Pantallas,Monitores LCD/LED,ok,False,1,1,1,"Monitor Gamer LG 27"" FHD, 144 Hz, IPS, 27G411A-B.AWH",0,0,False,{},,,,,,
56220,6749920,IMPRESORA ECOTANK PRO L6370,Epson,C11CL43303,329.87,158,Impresoras,Multifuncionales Inkjet,ok,False,1,24,24,Multifuncional Tinta Continua EcoTank L6370 Multifuncional WiFi-Direct /Dúplex,0,0,False,{},,364814,379990,299990,379990,369490
54319,6738880,LOQ E R7 16GB 512GB 15.6IN FHD RTX5060,Lenovo,83JG0019CL,1257.5,876,Computadores Servidores y Notebooks,Notebooks,ok,False,1,1,1,"Notebook Gamer AI PC LOQ Gen 10 AMD Ryzen 7-250 NVIDIA GeForce RTX 5060 15.6"" FHD 144Hz 16GB RAM 512GB Windows 11 Home Luna Grey 83JG0019CL",0,0,False,{},,279354,1406490,1229990,,1316062
53103,6751723,MOCHILA GRIS 16IN SP LITE,Kensington,K60398WW,12.89,102,Computadores Servidores y Notebooks,Bolsos y Mochilas p/Notebooks,ok,False,1,30,+30,"Mochila para Notebook Simply Portable Waterproof 16"" - Gris",0,0,False,{},,,,,,
54630,6764211,SSD Wd Green de 1 TB SATA3 2.5,Sandisk,WDS100T5G0A,237.02,490,Dispositivos de Almacenamiento,Discos de Estado Sólido SATA (SSD),ok,True,0,100,+100,"Unidad SSD 1TB 2.5"" SATA3 Western Digital Green ",0,0,False,{},,355828,,114990,,231029
55186,6764232,SSD Wd Green SN3000 1 TB NVMe,Sandisk,WDS100T4G0E,234.16,150,Dispositivos de Almacenamiento,Discos de Estado Sólido PCIe (SSD),ok,True,0,100,+100,Unidad SSD 1TB SN3000 NVMe SSD Green NVMe Performance,0,0,False,{},,361011,,124990,,208482
55799,6779529,SMART TV LG 65IN QNED AI 4K,Lg,65QNED73ASA.AWH,520.31,89,Pantallas,TV LCD/LED,ok,False,1,14,14,"Smart TV LG 65"" QNED73ASA.AWH",0,0,False,{},,,,,,
55306,6783816,Monitor Samsung Odyssey G5 32IN IPS QHD,Samsung,LS32FG500ELXZS,208.51,51,Pantallas,Monitores LCD/LED,ok,False,1,50,+50,"Monitor Gamer Samsung 32"", QHD, 180Hz, VA, 1ms, HDR10, FreeSync, Odyssey G5 LS32FG500ELXZS",0,0,False,{},,368697,281290,238440,,260344
56195,6783814,Monitor Gamer Samsung Odyssey G5 27IN QH,Samsung,LS27FG500ELXZS,173.67,100,Pantallas,Monitores LCD/LED,ok,False,1,50,+50,"Monitor Gamer Samsung 27"" QHD, 180Hz, Odyssey G5 G50F, LS27FG500ELXZS",0,0,False,{},,384137,214990,159990,199990,198880
55305,6783817,Monitor Samsung Smart M5 27IN VA FHD,Samsung,LS27FM501ELXZS,159.37,35,Pantallas,Monitores LCD/LED,ok,False,1,5,5,"Monitor Smart Samsung 27"", FHD, 60Hz , VA, 4ms, HDR, LS27FM501ELXZS",0,0,False,{},,379069,182990,182990,,189086
54579,6784290,PRIME B650EM-A WIFI//SOCKET AM5,Asus,90MB1LM0-M0EAY0,132.21,81,Componentes de Sistema,Tarjetas Madre AMD,ok,False,1,30,+30,Placa Madre AMD PRIME B650EM-A WIFI (sAM5),0,0,False,{},,,,,,
56196,6783819,Monitor Samsung Odyssey G6 27IN QHD,Samsung,LS27FG602ELXZS,355.04,50,Pantallas,Monitores LCD/LED,ok,False,1,19,19,"Monitor Gamer Samsung 27"" QHD, 350Hz, Odyssey G6 G60F, LS27FG602ELXZS",0,0,False,{},,369294,399990,389990,,502174
54390,6783820,Monitor Samsung S8 37IN VA 4K UHD,Samsung,LS37D800UALXZS,375.66,29,Pantallas,Monitores LCD/LED,ok,False,1,3,3,"Monitor Samsung ViewFinity S8 37"" ",0,0,False,{},,274084,444990,425590,,441468
55624,6784292,PRIME H610M-K,Asus,90MB1GA0-MVAAY0,71.28,155,Componentes de Sistema,Tarjetas Madre Intel,ok,False,1,29,29,Placa Madre Intel PRIME H610M-K (s1700),0,0,False,{},,,,,,
56103,6804958,27IN Odyssey G5 G53F QHD 200Hz Panel IPS,Samsung,LS27FG530ELXZS,142.02,330,Pantallas,Monitores LCD/LED,ok,False,1,19,19,"Monitor Gamer Samsung 27"", QHD, 200Hz, IPS, 1ms, HDR10, FreeSync, Odyssey G5 LS27FG530ELXZS",0,0,False,{},,367652,193990,177883,,186976
56454,6805750,ThinkStation P5 W32425 32G x1 W11PWS,Lenovo,30G9S81000,3852.3,4,Computadores Servidores y Notebooks,Workstations,ok,True,0,4,4,Desktop Workstation ThinkStation P5 Intel Xeon W3-2425 32GB RAM 512GB SSD NVIDIA RTX 2000 Ada 16GB Windows 11 Pro ,0,0,False,{},,,,,,
48503,6822114,MOUSE INALAMBRICO GAMING,Hp,6N0B0AA,70.69,30,Dispositivos de Entrada,Mouse,ok,False,1,26,26,Mouse Gamer Inalámbrico HyperX Pulsefire Haste 2 - Negro,0,0,False,{},,226714,69990,44990,,61740
