pcf_id,ingram_part,description,vendor_name,vendor_part,customer_price,available_qty,category,subcategory,api_status,mayorista,lista,stock_pcf,stock_raw,nombre_pcf,precio_normal,precio_oferta,ficha_vacia,stock_detail,error,solotodo_id,pcf_price,min_price,mode_price,mean_price
55623,4970353,PRIME A520M-K mATX +2GLN+U3.2+M2 SATA6+4,Asus,90MB1500-M0EAY0,49.02,942,Componentes de Sistema,Tarjetas Madre AMD,ok,False,1,50,+50,Placa Madre AMD PRIME A520M-K,0,0,False,{},,,,,,
38247,5003313,Pro Fit Ergonomic Wireless Black Keybrd,Kensington,K75401ES,26.17,9,Dispositivos de Entrada,Teclados,ok,False,1,50,+50,Teclado Inalámbrico Bluetooth Pro Fit Ergonómico Español - Negro,0,0,False,{},,86886,32990,19995,,33764
53318,5022494,PRIMO MICROPHONE,Trust,21674,2.5,451,Dispositivos Audio/Video,Micrófonos para PCs,ok,False,1,50,+50,Micrófono Trust Primo Alta definición - Negro,0,0,False,{},,,,,,
51032,5037945,Slim NanoSaver Combination Laptop Lock,Kensington,K60603WW,22.87,104,Seguridad Física,Opciones de Seguridad Física y Accs,ok,False,1,50,+50,Cable de Seguridad NanoSaver™ para notebooks 1.8 mts,0,0,False,{},,,,,,
52461,5094338,Wireless Router Wifi 6 1800,Linksys,E7350,110.0,21,Dispositivos de Red,Routers y Gateways inalámbricos,ok,False,1,1,1,Router Linksys E7350 AX1800 Dual Band,0,0,False,{},,,,,,
39623,5037986,MULTFUNCIONAL PIXMA G 3110 WIFI,Canon,2315C005,129.72,303,Impresoras,Multifuncionales Inkjet,ok,False,1,100,+100,Multifuncional Tinta Continua Pixma G3110 WiFi,0,0,False,{},,46519,149990,119990,,160284
54317,5141389,SANDISK ULTRA SHIFT USB3.0 CZ410 64GB,Sandisk,SDCZ410-064G-G46,10.71,126,Dispositivos de Almacenamiento,Pendrives y Unidades Flash Portables,ok,False,1,13,13,Pendrive 64GB USB 3.2 Ultra Shift Negro,0,0,False,{},,100387,8990,7990,8990,12076
47469,5141388,SANDISK ULTRA SHIFT USB3.0 CZ410 32GB,Sandisk,SDCZ410-032G-G46,8.58,400,Dispositivos de Almacenamiento,Pendrives y Unidades Flash Portables,ok,False,1,2,2,Pendrive 32GB USB 3.2 Ultra Shift Negro,0,0,False,{},,100388,7990,6990,13990,10979
51677,5141390,SANDISK ULTRA SHIFT USB3.0 CZ410 128GB,Sandisk,SDCZ410-128G-G46,17.23,84,Dispositivos de Almacenamiento,Pendrives y Unidades Flash Portables,ok,False,1,100,+100,Pendrive 128GB USB 3.2 Ultra Shift Negro,0,0,False,{},,100386,13990,13278,26990,22573
54929,5165540,"MH27M1 ViewSonic, visera monitores 27",Viewsonic,MH27M1,56.19,2,Pantallas,"Brazos, Pedestales, Montaje p/Monitores",ok,False,1,4,4,MH27M1 ViewSonic visera monitores 27,0,0,False,{},,,,,,
53326,5177632,GXT266 4-PACK THUMB GRIPS PS5,Trust,24170,3.55,931,Video Juegos y Consolas,Joysticks,ok,False,1,5,5,Pack de 4 Protectores de Análogo para PS5 Trust GXT 266 ,0,0,False,{},,,,,,
38921,5194572,BOTELLA T49H400 AMARILLO 110ML T3170X,Epson,T49H400,24.51,1,Suministros y Medios,Suministros Inyección de Tinta,ok,False,1,1,1,Botella de Tinta Original Epson T49H400 Amarillo  / 140ml,0,0,False,{},,259626,26990,26990,,33725
42877,5231206,RYZEN 7 5700G 4.60GHZ 8CORE WITH COOLER,Amd,100-100000263BOX,188.27,238,Componentes de Sistema,Procesadores AMD,ok,False,1,4,4,CPU AMD Ryzen 7 5700G (AM4),0,0,False,{},,117428,208990,189900,199900,209746
42912,5276449,GI-16 AMARILLO,Canon,4420C001,20.16,8,Suministros y Medios,Suministros Inyección de Tinta,ok,False,1,13,13,Botella de Tinta Original Canon GI-16 Amarillo ,0,0,False,{},,259344,23990,22408,28990,27539
46030,5354564,Win Server 2022 Standard Edition License,Dell,634-BYKQ,170.3,14,Software,SW Sistemas Operativos Windows,ok,False,1,23,23,"CAL - Windows Standard Edition, Licencia Adicional 2 CORE DELL",0,0,False,{},,,,,,
44289,5330107,WINDOWS 11 PRO,Microsoft,FQC-10553,137.97,199,Software,SW Sistemas Operativos Windows,ok,False,1,1,1,Windows 11 Profesional OEM 64 bits	,0,0,False,{},,,,,,
44166,5290680,ECOTANK L3250,Epson,C11CJ67304,190.8,544,Impresoras,Multifuncionales Inkjet,ok,False,1,100,+100,Multifuncional Tinta Continua EcoTank L3250 WiFi-Direct ,0,0,False,{},,126333,209990,178700,209990,209581
33142,5449241,HX PULSEFIRE CORE GAMING MOUSE BLK,Hp,4P4F8AA,25.73,4,Dispositivos de Entrada,Mouse,ok,False,1,30,+30,Mouse Gamer Alámbrico Pulsefire Core Global -  Negro,0,0,False,{},,234436,,,,
45373,5440999,PACK 4 TINTAS CMYK SERIE T544L120 L310/3,Epson,T544520-4P,26.79,7195,Suministros y Medios,Suministros Inyección de Tinta,ok,False,1,100,+100,Pack 4 Botellas de Tinta Original Epson T544520-4P Colores ,0,0,False,{},,259908,33990,29321,35990,33124
51094,5475220,Kensington W2000 1080p Auto Focus Webcam,Kensington,K81175WW,45.85,3,Cámaras y Escáners,Cámaras Web,ok,False,1,30,+30,Webcam Auto Foco Modelo W2000 1080P,0,0,False,{},,,,,,
51095,5475221,Kensington W2050 1080p Auto Focus Webcam,Kensington,K81176WW,65.53,4,Cámaras y Escáners,Cámaras Web,ok,False,1,30,+30,Webcam Pro Auto Foco Modelo W2050 ,0,0,False,{},,,,,,
44161,5505953,GI-13 NEGRO,Canon,4695C001,12.97,44,Suministros y Medios,Suministros Inyección de Tinta,ok,False,0,1,1,Botella de Tinta Original Canon GI-13 Negro,0,0,False,{},,259340,,16990,,17007
44160,5505952,GI-13 AMARILLO,Canon,4686C001,12.97,43,Suministros y Medios,Suministros Inyección de Tinta,ok,False,0,1,1,Botella de Tinta Original Canon GI-13 Amarillo,0,0,False,{},,259341,,15989,,16989
43165,5530137,LASER POINTER KENSINGTON K33272WW,Kensington,K33272WW,14.37,1,Dispositivos Audio/Video,Dispositivos Interactivos de Presentació,ok,False,1,100,+100,Presentador Inalámbrico 2.4Ghz con Puntero Laser Negro,0,0,False,{},,,,,,
47290,5607532,MONITOR LS25BG400ELXZS,Samsung,LS25BG400ELXZS,179.43,56,Pantallas,Monitores LCD/LED,ok,False,1,22,22,"Monitor Gamer Samsung 25"", FHD, 240Hz, IPS, 1ms, G-Sync, HDR10, Odyssey G4 LS25BG400ELXZS",0,0,False,{},,150697,218190,159900,259990,218496
47291,5607534,MON LS27BG400EL G4 1920X1080 IPS 240HZ,Samsung,LS27BG400ELXZS,194.89,46,Pantallas,Monitores LCD/LED,ok,False,1,30,+30,"Monitor Gamer 27"", Full HD, 240Hz, IPS, 1ms, HDR10, G-Sync, Odyssey G4 LS27BG400ELXZS",0,0,False,{},,150696,239990,197990,289990,249968
48479,5632975,L1250 (220V) LATIN SFP WI-FI,Epson,C11CJ71303,139.12,478,Impresoras,Impresoras de Inyección de Tinta,ok,False,1,100,+100,Impresora Tinta Continua EcoTank L1250 WiFi,0,0,False,{},,135996,159990,135230,149990,154212
40090,5662138,SANDISK ULTRA MICROSDHC 128GB CLASS 10,Sandisk,SDSQUNR-128G-GN3MA,16.57,2331,Dispositivos de Almacenamiento,Tarjetas de Memoria Flash,ok,False,1,100,+100,Memoria 128GB microSDXC 100 MB/s UHS-1 U1 Ultra,0,0,False,{},,98955,17990,17990,,23640
41413,5665506,COMBO INALAMBRICO ERGONOMICO K75406ES,Kensington,K75406ES,37.33,22,Dispositivos de Entrada,Teclados,ok,False,1,100,+100,Combo Teclado + Mouse Inalámbrico Bluetooth Pro Fit ERGO Dual - Negro,0,0,False,{},,112916,47990,42494,,45055
47616,5677899,MULTI-DEVICE WIRELESS MOUSE 430,Hp,3B4Q2AA#ABL,18.43,786,Dispositivos de Entrada,Mouse,ok,False,1,50,+50,Mouse Inalámbrico HP 430 Multi-Device - Negro,0,0,False,{},,,,,,
55219,5677923,HP USB-C 65W LAPTOP CHARGER LTNA,Hp,671R2AA#ABM,24.78,3192,Computadores Servidores y Notebooks,Accesorios de Energía para Notebooks,ok,False,1,50,+50,Cargador de Notebook 65W 671R2AA USB C - Negro,0,0,False,{},,,,,,
41115,5680854,RYZEN 5 7600 5 20GHZ 6 CORE SKT AM5 38MB,Amd,100-100001015BOX,195.48,116,Componentes de Sistema,Procesadores AMD,ok,False,1,8,8,CPU AMD Ryzen 5 7600 (AM5),0,0,False,{},,166287,219990,204490,,227326
48594,5736116,ECOTANK MFP L5590,Epson,C11CK57303,278.25,310,Impresoras,Multifuncionales Inkjet,ok,False,1,100,+100,Multifuncional Tinta Continua EcoTank L5590 WiFi / Ethernet,0,0,False,{},,199704,299990,227966,284990,293459
35368,5736863,PORTABLE USB 3 0 HUB K39121,Kensington,K39121,13.05,27,Dispositivos de Entrada/Salida,Dispositivos de Conectividad USB,ok,False,1,100,+100,HUB USB 3.0 4 Puertos UH4000,0,0,False,{},,,,,,
52307,5780147,POCKETHUB CH1200 USB-C 4 x USB-A 3.0,Kensington,K33616WW,19.61,9,Dispositivos de Entrada/Salida,Conmutadores para dispositivos USB,ok,False,1,100,+100,Hub USB-C CH1200 de 4 puertos a 10 Gbps ,0,0,False,{},,,,,,
6254,5736864,PAD MOUSE PILLOW L57822,Kensington,L57822,5.17,10,Equipamiento de Oficina,"Mousepads, Apoyamuñecas y Descanso",ok,False,1,100,+100,MousePad Wrist Pillow - Negro ,0,0,False,{},,,,,,
51134,5790666,Universal Tabletop Aluminum Laptop Riser,Kensington,K50424WW,26.17,1,Computadores Servidores y Notebooks,Dockings y Pedestales p/Notebooks,ok,False,1,50,+50,"Base para Notebook Universal Aluminio hasta 16"" - Plateado",0,0,False,{},,,,,,
52383,5855590,MONITOR LS34C500GA PLANO 3440X1440 VA,Samsung,LS34C500GALXZS,243.69,1,Pantallas,Pantallas Comerciales LCD/LED,ok,False,1,5,5,"Monitor Samsung 34"", WQHD, 100Hz, Va, Freesync, ViewFinity S5, LS34C500GALXZS",0,0,False,{},,211022,284990,244990,,281947
26915,5783787,HEAD STRAP 2.0,Gopro,ACHOM-002,15.4,92,Cámaras y Escáners,Kits de Accesorios para Cámaras,ok,False,1,30,+30,Correa para la Cabeza Head Strap + QuickClip 2.0,0,0,False,{},,,,,,
54588,5868763,BAG T11A220-AL CYAN WF-C5890 5K PAG,Epson,T11A220-AL,49.13,466,Suministros y Medios,Suministros Inyección de Tinta,ok,True,0,100,+100,Bolsa de Tinta Epson T11A220-AL Cyan,0,0,False,{},,259981,,53890,,58799
54589,5868764,BAG T11A320-AL MAGENTA WF-C5890 5K PAG,Epson,T11A320-AL,49.13,470,Suministros y Medios,Suministros Inyección de Tinta,ok,True,0,100,+100,Bolsa de Tinta Epson T11A320-AL Magenta,0,0,False,{},,259980,,53900,,58500
54590,5868805,BAG T11A420-AL YELLOW WF-C5890 5K PAG,Epson,T11A420-AL,49.13,473,Suministros y Medios,Suministros Inyección de Tinta,ok,True,0,100,+100,Bolsa de Tinta Epson T11A420-AL Amarilla,0,0,False,{},,259977,,53900,,59045
50261,5889079,PIXMA G3170 BLACK USB WIFI,Canon,5805C005,143.68,69,Impresoras,Multifuncionales Inkjet,ok,False,1,50,+50,Multifuncional Tinta Continua Pixma G3170 WiFi,0,0,False,{},,216635,169990,144990,169990,175509
54586,5868806,BAG T11B120-AL BLACK XL WF-C5890 10K PAG,Epson,T11B120-AL,47.54,327,Suministros y Medios,Suministros Inyección de Tinta,ok,True,0,100,+100,Bolsa de Tinta Epson T11B120-AL XL Negro,0,0,False,{},,259978,,47090,,55871
52558,5914217,Back-UPS Connect UPS de 12 V CC con bate,Apc,CP12036LI,42.23,60,Protección Eléctrica y Racks,UPS,ok,False,1,1,1,UPS 12Vdc 36W SAI Back-UPS Connect  para Routers,0,0,False,{},,261792,64990,49856,,64608
50505,5906597,CORE I5-14600K 3 50GHZ SKTLGA1700 24.00M,Intel,BX8071514600K,250.59,5,Componentes de Sistema,Procesadores Intel,ok,True,0,5,5,CPU Intel Core i5-14600K (s1700),0,0,False,{},,222319,,284544,,307909
49621,5917221,EPIQVISION FH02,Epson,V11HA85020,615.37,231,Dispositivos Audio/Video,Proyectores LCD,ok,False,1,30,+30,Proyector Portátil Smart Epson Epiqvision CO-FH02,0,0,False,{},,236816,,489890,499990,635220
50260,5999348,PIXMA G2170 BLACK USB,Canon,5804C005,147.08,83,Impresoras,Impresoras de Inyección de Tinta,ok,False,0,1,1,Multifuncional Tinta Continua Pixma G2170 ,0,0,False,{},,218645,,129990,129990,158163
51059,5939666,TONER TN3609XXL DL RENDIMIENTO HASTA 110,Brother,TN3609XXL,120.35,87,Cámaras y Escáners,Escáners para el Hogar/Oficina,ok,True,0,50,+50,Toner Original Brother TN-3609XXL Negro,0,0,False,{},,260399,,132680,,147324
51064,5939021,IMPRESORA LASER MONO HLL5210DN,Brother,HLL5210DN,240.91,27,Impresoras,Impresoras Láser/LED monocromáticas,ok,True,0,26,26,Impresora Láser Blanco y Negro HLL-5210DN Ethernet,0,0,False,{},,228424,,245990,245990,273620
36122,6069363,HUB PORTABLE USB 2.0 K39120,Kensington,K39120,8.46,60,Dispositivos de Entrada/Salida,Conmutadores para dispositivos USB,ok,False,1,100,+100,HUB USB 2.0 4 Puertos UH4000,0,0,False,{},,,,,,
41441,6110755,KEYBOARD WIRELESS COMPACT K75502ES,Kensington,K75502ES,19.67,7,Dispositivos de Entrada,Teclados,ok,False,1,100,+100,Teclado Compacto Multidispositivo Inalámbrico Dual Wireless Bluetooth Negro,0,0,False,{},,112914,24990,14990,28004,24552
51417,6119329,CAMPUS XL MARBLE STONE BACKPACK 20L,Hp,7J592AA,24.0,25,Computadores Servidores y Notebooks,Bolsos y Mochilas p/Notebooks,ok,False,1,3,3,"Mochila para Notebooks Stone 16.1"" - Negro Mármol",0,0,False,{},,,,,,
51135,6110314,ALUMINUM NOTEBOOK BASE K50406WW,Kensington,K50406WW,16.34,21,Computadores Servidores y Notebooks,Dockings y Pedestales p/Notebooks,ok,False,1,100,+100,"Base para Notebook Metálica Plegable (K50406) hasta 16"" - Negro",0,0,False,{},,,,,,
51489,6114116,RYZEN 5 8500G AI 5.00GHZ 6 CORE SKT AM5,Amd,100-100000931BOX,137.19,92,Componentes de Sistema,Procesadores AMD,ok,False,1,16,16,CPU AMD Ryzen 5 8500G (AM5),0,0,False,{},,232385,159990,146390,146390,166141
50264,6123435,TECLADO INALAMBRICO COMPACTO K75504ES,Kensington,K75504ES,19.67,39,Dispositivos de Entrada,Combos Teclado/Mouse,ok,False,1,50,+50,Teclado Compacto Multidispositivo Inalámbrico Dual Wireless Bluetooth Blanco,0,0,False,{},,148017,24990,22249,,24297
52033,6159736,BASE MONITOR METAL EXTRA LONG K58305,Kensington,K58305,11.74,23,Pantallas,"Brazos, Pedestales, Montaje p/Monitores",ok,False,1,50,+50,"Base para Monitor Extra Larga metal hasta 34""",0,0,False,{},,,,,,
53448,6213555,16-R1015LA I7 16GB1TBSSD8V RTX4060,Hp,A14LXLA#ABM,1175.4,198,Computadores Servidores y Notebooks,Notebooks,ok,False,1,1,1,"Notebook Gamer Victus 16-r1015la Intel Core i7-14650H NVIDIA GeForce RTX 4060 16.1"" FHD 144Hz 16GB RAM 1TB SSD Windows 11 Home Gris A14LXLA#ABM",0,0,False,{},,,,,,
52211,6209667,LED MONITOR VA220-H 22IN FULL HD 250NITS,Viewsonic,VA220-H,55.64,736,Pantallas,Monitores LCD/LED,ok,False,1,100,+100,"Monitor Viewsonic 22"" FHD, 100Hz, VA, 1ms, VA220-H",0,0,False,{},,,,,,
52801,6261606,RYZEN 7 9700X 8-CORE PROCESSOR,Amd,100-100001404WOF,336.24,39,Componentes de Sistema,Procesadores AMD,ok,False,1,13,13,CPU AMD Ryzen 7 9700X (AM5),0,0,False,{},,252399,379990,350190,351990,377031
52802,6261609,RYZEN 9 9900X 12-CORE PROCESSOR,Amd,100-100000662WOF,415.24,19,Componentes de Sistema,Procesadores AMD,ok,False,1,6,6,CPU AMD Ryzen 9 9900X (AM5),0,0,False,{},,252400,469990,443990,499900,473273
52800,6261610,RYZEN 5 9600X 6-CORE PROCESSOR,Amd,100-100001405WOF,229.31,61,Componentes de Sistema,Procesadores AMD,ok,False,1,1,1,CPU AMD Ryzen 5 9600X (AM5),0,0,False,{},,252401,249990,199990,213890,247418
44635,6291422,LAPTOP SLV PROT REV 14 BLK/BLU,Hp,2F1X4AA,8.23,2002,Computadores Servidores y Notebooks,Bolsos y Mochilas p/Notebooks,ok,False,1,50,+50,"Funda Protectora Reversible para Notebook 14"" Negro/Azul",0,0,False,{},,,,,,
36215,6291140,200 WIRELESS BLACK MOUSE,Hp,X6W31AA#ABL,7.89,2456,Dispositivos de Entrada,Mouse,ok,False,1,100,+100,Mouse Inalámbrico HP 200  - Negro,0,0,False,{},,,,,,
52971,6291554,VELOP MICRO-ROUTER MICRO MESH 6,Linksys,LN11011201,171.49,2,Dispositivos de Red,Routers y Gateways inalámbricos,ok,False,1,2,2,Micro Router Linksys & 1x Micro Mesh WiFi 6 AX 3000,0,0,False,{},,369215,249990,188182,,204162
53859,6292201,GOPRO-Twin Pack Battery,Gopro,AEBAT-201,34.06,86,Cámaras y Escáners,Opciones de Energía para Cámaras,ok,False,1,15,15,Pack 2 Baterías Recargables Enduro para HERO13 Black,0,0,False,{},,,,,,
53860,6292209,GOPRO-Standalone Battery,Gopro,AEBAT-001,20.43,82,Cámaras y Escáners,Opciones de Energía para Cámaras,ok,False,1,21,21,Batería Recargable Enduro para HERO13 Black,0,0,False,{},,,,,,
52689,6294951,MONITOR LS27D700EAL 4K 3840x2160 IPS,Samsung,LS27D700EALXZS,241.19,59,Pantallas,Monitores LCD/LED,ok,False,1,100,+100,"Monitor Samsung 27"", 4K, 60Hz, IPS, 5ms, HDR10, ViewFinity S7 LS27D700EALXZS",0,0,False,{},,246833,279990,249990,,286870
52632,6292516,WIRELESS MICRO ROUTER AC1200,Linksys,LN3101-LA,26.84,19,Dispositivos de Red,Componentes para Router,ok,False,1,50,+50,Micro Router Linksys LN3101 WiFi 5 AC1200 Dual Band,0,0,False,{},,369208,44990,29452,,37062
53178,6294940,MONITOR LS24D600UA 2560x1440 IPS USB-C,Samsung,LS24D600UALXZS,213.09,42,Pantallas,Monitores LCD/LED,ok,False,1,30,+30,"Monitor Samsung 24"", QHD, 100Hz, IPS, 5ms, ViewFinity S6 LS24D600UALXZS",0,0,False,{},,246825,269990,238787,299990,267819
54241,6315076,CRUCIAL T500 500GB PCIE GEN4 NVME M.2 SS,Crucial,CT500T500SSD8,153.0,6,Dispositivos de Almacenamiento,Discos de Estado Sólido PCIe (SSD),ok,False,1,50,+50,Unidad SSD T500 500GB PCIe Gen4 NVMe M.2,0,0,False,{},,254708,149990,141500,,166197
52121,6324674,GOPRO CAMARA HERO FRACTION,Gopro,CHDHF-131-AS,193.07,201,Cámaras y Escáners,Cámaras de Video Digital,ok,False,1,5,5,Cámara Hero Black,0,0,False,{},,,,,,
54618,6325277,MICROFONO QUADCAST 2 NEGRO,Hp,872V1AA,86.82,375,Dispositivos Audio/Video,Micrófonos para PCs,ok,False,1,24,24,Micrófono Gamer HyperX QuadCast 2 - Negro,0,0,False,{},,,,,,
54661,6315171,LOQ GEN9 I5 16GB 512SSD W11H,Lenovo,83GS00G8CL,756.93,70,Computadores Servidores y Notebooks,Notebooks,ok,False,1,1,1,"Notebook Gamer LOQ Gen 9 Intel Core i5-12450HX NVIDIA GeForce RTX 3050 15.6"" FHD 144Hz 16GB RAM 512GB SSD Windows 11 Home Luna Grey 83GS00G8CL",0,0,False,{},,254636,824490,811990,,863693
54989,6327493,PRIME A620M-K,Asus,90MB1F40-M0EAY0,74.81,527,Componentes de Sistema,Tarjetas Madre AMD,ok,False,1,50,+50,Placa Madre AMD PRIME A620M-K,0,0,False,{},,,,,,
56241,6332146,MSI MINI PC CUBI CUBI 5 12M-086BUS CI3,Msi,936-B0A811-086,219.8,54,Computadores Servidores y Notebooks,Computadores Small Form/Ultra Slim,ok,True,0,30,+30,MSI MINI PC CUBI CUBI 5 12M-086BUS CI3,0,0,False,{},,,,,,
54593,6338363,TUF GAMING X870-PLUS WIFI,Asus,90MB1IU0-M0EAY0,291.45,63,Componentes de Sistema,Tarjetas Madre Intel,ok,False,1,21,21,Placa Madre Asus TUF GAMING X870-PLUS WIFI,0,0,False,{},,,,,,
52514,6326048,EarPods (USB-C),Apple,MYQY3AM/A,16.66,200,Comunicaciones,Cintillos telefónicos,ok,False,1,8,8,Audífonos EarPods USB-C Apple,0,0,False,{},,264934,,18990,,21637
52955,6338369,MONITOR LS32D700EAL 4K 3840X2160 IPS,Samsung,LS32D700EALXZS,263.67,36,Pantallas,Monitores LCD/LED,ok,False,1,22,22,"Monitor Samsung 32"", UHD, 60Hz, VA, 5ms, ViewFinity S7 LS32D700EALXZS",0,0,False,{},,246834,314990,299642,,318525
47619,6341650,HP MOCHILA PRELUDE 15.6IN GRIS,Hp,2Z8P3AA,12.43,575,Computadores Servidores y Notebooks,Bolsos y Mochilas p/Notebooks,ok,False,1,30,+30,"Mochila Prelude G2 15.6"" Gris",0,0,False,{},,,,,,
47902,6341651,HP MOUSE INALAMBRICO 150 NEGRO,Hp,2S9L1AA#ABM,9.32,547,Dispositivos de Entrada,Mouse,ok,False,1,50,+50,Mouse Inalámbrico HP 150 - Negro,0,0,False,{},,,,,,
47617,6341653,HP TECLADO INALAMBRICO COMPACTO 350,Hp,692S8AA#ABM,18.96,1236,Dispositivos de Entrada,Teclados,ok,False,1,100,+100,Teclado Inalámbrico HP 350 Compact Multi-Device - Negro,0,0,False,{},,,,,,
52687,6359937,MONITOR LS27DG300ELXZS,Samsung,LS27DG300ELXZS,114.64,104,Pantallas,Monitores LCD/LED,ok,False,1,50,+50,"Monitor Gamer Samsung 27"", FHD, 180Hz, VA, 1ms, FreeSync, Odyssey G3 LS27DG300ELXZS",0,0,False,{},,253813,139990,114990,179990,150561
53814,6375388,TABLET PRO 12.7IN 3K D8300 8GB 256GB PEN,Lenovo,ZAE40165CL,339.23,501,Computadores Servidores y Notebooks,Tablets y Tablet PCs,ok,False,1,100,+100,"Tablet Tab Pro 12.7"" 8GB 256GB Wi-Fi Octa Core Android Luna Grey + Funda + Lápiz + Teclado + Earbuds",0,0,False,{},,265289,419990,393811,409990,426232
53195,6379933,BOTELLA DE TINTA CIAN BTD100C,Brother,BTD100C,6.94,186,Suministros y Medios,Suministros Inyección de Tinta,ok,False,1,100,+100,Botella de Tinta Original Brother BTD100C Cyan,0,0,False,{},,259756,8990,7650,9990,9285
53198,6379935,BOTELLA DE TINTA NEGRA BTD100BK,Brother,BTD100BK,7.64,179,Suministros y Medios,Suministros Inyección de Tinta,ok,False,1,50,+50,Botella de Tinta Original Brother BTD100BK Negro,0,0,False,{},,259754,9990,8406,10990,10268
53197,6379930,BOTELLA DE TINTA AMARILLA BTD100Y,Brother,BTD100Y,6.94,436,Suministros y Medios,Suministros Inyección de Tinta,ok,False,1,100,+100,Botella de Tinta Original Brother BTD100Y Amarillo,0,0,False,{},,259758,8990,7650,9990,9469
53196,6379932,BOTELLA DE TINTA MAGENTA BTD100M,Brother,BTD100M,6.94,231,Suministros y Medios,Suministros Inyección de Tinta,ok,False,1,100,+100,Botella de Tinta Original Brother BTD100M Magenta,0,0,False,{},,259755,8990,7650,9990,9419
53194,6379940,MULTIFUNCIONAL DCP-T930DW,Brother,MFCT930DW,293.14,11,Impresoras,Multifuncionales Inkjet,ok,False,1,100,+100,Multifuncional Tinta Continua InkBenefit Tank MFCT930DW Direct/Dúplex,0,0,False,{},,260839,259990,199990,,273644
55670,6399144,HP DesignJet T250 24-in Printer,Hp,5HB06D,751.9,81,Impresoras,Plotters color,ok,True,0,50,+50,"Kit Plotter 24"" DesignJet T250 WiFi / Ethernet / USB in ePrinter con porta rollo + Incluye Alimentador automático de hojas ",0,0,False,{},,273156,,619990,699990,946795
44636,6406894,HP FUNDA REVERSIBLE 15IN NEGRO AZUL,Hp,2F1X7AA,8.44,465,Computadores Servidores y Notebooks,Bolsos y Mochilas p/Notebooks,ok,False,1,50,+50,"Funda Protectora Reversible para Notebook 15.6"" Negro/Azul",0,0,False,{},,,,,,
54201,6417090,YOGA SNAPDRAGON 8 G3 16GB 256GB 12.7IN,Lenovo,ZAEG0024CL,566.87,158,Computadores Servidores y Notebooks,Tablets y Tablet PCs,ok,False,1,4,4,"Tablet Yoga Tab Plus 12,7"" 16GB 256GB Wi-Fi Octa Core Azul + Teclado + Funda + Lápiz",0,0,False,{},,,,,,
53809,6457293,IDEAPAD 3 G10 I5 13420H 16GB 1TB 15.3IN,Lenovo,83K100BWCL,650.76,487,Computadores Servidores y Notebooks,Notebooks,ok,False,1,5,5,"Notebook Ideapad Slim 3 Intel Core i5-13420H 15.3"" WUXGA Touch 60Hz 16GB 1TB SSD Windows 11 Gris 83K100BWCL",0,0,False,{},,269700,727490,689990,729990,737150
55675,6456329,CLOUD JET AURICULARES GAMING INALAMBRICO,Hp,AJ0T1AA,36.53,10,Dispositivos Audio/Video,Cintillos y Audífonos para PCs,ok,False,1,14,14,Audífonos Gamer Hyper X Cloud Jet Wireless Negro,0,0,False,{},,364132,47990,38990,,43491
53913,6417091,LEGION SNAPDRAGON 8 G3 12GB 256GB 8.8IN,Lenovo,ZAEF0041CL,430.76,582,Computadores Servidores y Notebooks,Tablets y Tablet PCs,ok,False,1,6,6,"Tablet Gamer Legion Tab Qualcomm Snapdragon 8 Gen 3 8.8"" QHD 12GB 256GB WiFi Octa Core Android Negro + Funda",0,0,False,{},,265288,465590,439990,499990,493763
55626,6500385,GeForce RTX 5070 12G SHADOW 2X OC,Msi,912-V532-011,658.89,35,Video Juegos y Consolas,Otros Accesorios para Videojuegos,ok,False,1,24,24,Tarjeta de Video NVIDIA GeForce RTX 5070 12G SHADOW 2X OC,0,0,False,{},,271979,789990,698630,718990,738221
49077,6486381,LG XBOOM RNC5 SOUND BAR,Lg,RNC5.DCHLLLK,160.31,352,Dispositivos Audio/Video,Parlantes y Subwoofers Entretención/Pro,ok,False,1,17,17,Torre de Sonido LG XBOOM RNC5,0,0,False,{},,,,,,
56365,6457295,IDEAPAD 3 G10 I5 13420H 8GB 512GB 15.3IN,Lenovo,83K1004WCL,542.34,1370,Computadores Servidores y Notebooks,Notebooks,ok,True,0,100,+100,"Notebook Ideapad Slim 3 Intel Core i5-13420H 8GB RAM 512GB SSD 15.3"" Touch Windows 11 Home 83K1004WCL",0,0,False,{},,279190,,549990,,590779
50797,6486382,LG SMART TV LED 32LQ600BPSA 32 IN HD,Lg,32LQ600BPSA.AWHQ,181.18,1,Pantallas,TV LCD/LED,ok,False,1,1,1,"Smart TV LED 32"" 32LQ600BPSA HD",0,0,False,{},,,,,,
55430,6500388,GeForce RTX 5070 12G VENTUS 2X OC,Msi,912-V532-009,681.82,48,Video Juegos y Consolas,Otros Accesorios para Videojuegos,ok,False,1,23,23,Tarjeta de Video NVIDIA Geforce RTX  5070 12G Ventus 2X OC,0,0,False,{},,271705,829990,709990,749900,784332
53700,6501044,MONITOR 34 IN ODYSSEY OLED G8,Samsung,LS34DG850SLXZS,894.19,3,Pantallas,Monitores LCD/LED,ok,False,1,4,4,"Monitor Samsumg Curvo 34"", UWQHD, Panel OLED, 0.03ms, HDR10, Odyssey G8, LS34DG850SLXZS",0,0,False,{},,261783,979690,897877,,992033
54152,6509276,CAMARA MAX 360,Gopro,CHDHZ-203-RW,324.95,284,Cámaras y Escáners,Cámaras de Video Digital,ok,False,1,5,5,Cámara GoPro MAX 360 Black,0,0,False,{},,,,,,
48503,6567740,MOUSE INALAMBRICO GAMING,Hp,6N0B0AA,52.08,42,Dispositivos de Entrada,Mouse,ok,False,1,26,26,Mouse Gamer Inalámbrico HyperX Pulsefire Haste 2 - Negro,0,0,False,{},,226714,69990,44990,,61291
47616,6585365,MOUSE INALÁMBRICO MULTI 430,Hp,3B4Q2AA#ABL,17.69,64,Dispositivos de Entrada,Mouse,ok,False,1,50,+50,Mouse Inalámbrico HP 430 Multi-Device - Negro,0,0,False,{},,,,,,
54648,6584746,AIO A100 G7 I3 N305 8GB 512GB 24IN M/K,Lenovo,F0J6002JCL,434.81,9,Computadores Servidores y Notebooks,Computadores con Monitor integrado,ok,False,1,5,5,"All in One A100 Gen 7 Intel Core i3-N305 23.8"" FHD 8GB 512GB SSD Windows 11 Home Cloud Grey F0J6002JCL+ Mouse/KB Wireless",0,0,False,{},,278306,543190,495990,,530124
55843,6590147,YOGA SLIM 7 10GEN CORE ULTRA7 32GB 1TB,Lenovo,83JX002VCL,1145.8,22,Computadores Servidores y Notebooks,Notebooks,ok,False,1,50,+50,"Notebook Yoga Slim 7 Gen 10 Intel Core Ultra 7 14"" OLED 120Hz 32GB 1TB Windows 11 Home 83JX002VCL",0,0,False,{},,274067,1299990,1249990,1299990,1286083
54389,6589745,MONITOR GAMING ODYSSEY G7 DE 27 IN,Samsung,LS27DG700ELXZS,441.37,52,Pantallas,Monitores LCD/LED,ok,False,1,13,13,"Monitor Gamer Samsung 27""  4K,144Hz, Fast IPS, 1ms, HDR10+, Odyssey G7 G70D",0,0,False,{},,271820,489990,436990,519990,492602
53891,6598977,X1605VA MB205W i9 13900H 16 512 UMA 16IN,Asus,90NB10N3-M01B40,901.61,102,Computadores Servidores y Notebooks,Notebooks,ok,False,1,10,10,"Notebook Vivobook 16 Intel Core i9-13900H 16.0"" WUXGA 60Hz 16GB 512GB Windows 11 Home Negro X1605VA-MB205W",0,0,False,{},,272618,872990,839990,,933147
54391,6604498,MONITOR SAMSUNG ESSENTIAL LS22D300GALXZS,Samsung,LS22D300GALXZS,60.76,48,Pantallas,Monitores LCD/LED,ok,False,1,100,+100,"Monitor Samsung 22"", FHD, Panel IPS, Essential S3 100 Hz, 5ms LS22D300GALXZS",0,0,False,{},,274200,79990,65900,99990,78134
54388,6604497,MONITOR SAMSUNG LS27F320GALXZS,Samsung,LS27F320GALXZS,109.85,118,Pantallas,Monitores LCD/LED,ok,False,1,100,+100,"Monitor Samsung 27"" FHD, 120Hz, IPS, Essential S3, LS27F320GALXZS",0,0,False,{},,276533,112990,97000,97000,109759
54819,6626609,MONITOR 32U631A-B 2560X1440 IPS 31.5PULG,Lg,32U631A-B.AWHQ,217.45,217,Pantallas,Monitores LCD/LED,ok,False,1,2,2,"Monitor LG 32"" QHD IPS 100Hz HDMI USB-C VESA",0,0,False,{},,,,,,
55061,6638426,MONITOR GAMINGVX2729 27IN 200HZ FHD,Viewsonic,VX2729,102.74,41,Pantallas,Monitores LCD/LED,ok,False,1,100,+100,"Monitor Gamer ViewSonic, 27"", FHD, 200Hz,, Fast IPS 1ms, Free Sync Premium, VX2729   ",0,0,False,{},,364178,134990,112900,,124489
