pcf_id,ingram_part,description,vendor_name,vendor_part,customer_price,available_qty,category,subcategory,api_status,mayorista,lista,stock_pcf,stock_raw,nombre_pcf,precio_normal,precio_oferta,ficha_vacia,stock_detail,error,solotodo_id,pcf_price,min_price,mode_price,mean_price
55843,6590147,YOGA SLIM 7 10GEN CORE ULTRA7 32GB 1TB,Lenovo,83JX002VCL,1211.4,186,Computadores Servidores y Notebooks,Notebooks,ok,False,1,24,24,"Notebook Yoga Slim 7 Gen 10 Intel Core Ultra 7 14"" OLED 120Hz 32GB 1TB Windows 11 Home 83JX002VCL",0,0,False,{},,274067,1349990,1299990,,1341534
56245,6594555,GeForce RTX 5060 8G VENTUS 2X OC WHITE,Msi,912-V537-018,401.37,43,Componentes de Sistema,Opciones BTO para PCs,ok,False,1,21,21,Tarjeta de Video Nvidia GeForce RTX 5060 8G VENTUS 2X OC WHITE,0,0,False,{},,,,,,
56535,6629493,APC EASY UPS 1600VA,Apc,BVG1600I-MSX,105.48,2,Protección Eléctrica y Racks,UPS,ok,True,0,1,1,APC EASY UPS 1600VA,0,0,False,{},,363510,,115910,,123986
56536,6629496,APC EASY UPS 2200VA,Apc,BVG2200I-MSX,126.02,11,Protección Eléctrica y Racks,UPS,ok,True,0,26,26,APC EASY UPS 2200VA,0,0,False,{},,363229,,139772,,140684
56537,6629495,APC EASY UPS 700VA,Apc,BVG700I-MSX,52.53,30,Protección Eléctrica y Racks,UPS,ok,True,0,29,29,APC EASY UPS 700VA,0,0,False,{},,361104,,52900,,56406
56530,6644591,ASUS DUAL RADEON RX 7600 EVO OC EDITION,Asus,90YV0LD0-M0AA00,301.67,791,Componentes de Sistema,Tarjetas Gráficas AMD,ok,True,0,100,+100,Tarjeta de Video AMD DUAL RADEON RX 7600 EVO OC EDITION,0,0,False,{},,,,,,
55314,6650021,24IN FULL HD 120HZ MONITOR WITH BUILT-IN,Viewsonic,VA2456A-MHD,73.21,1529,Pantallas,Monitores LCD/LED,ok,False,1,100,+100,"Monitor ViewSonic 24"" FHD, 120HZ, VGA, DP, HDMI, VA2456A-MHD",0,0,False,{},,,,,,
54339,6674284,MONITOR LG CURVO 24 INCHES FHD 100HZ 5MS,Lg,24U421A-B.AWHQ,71.08,87,Pantallas,Monitores LCD/LED,ok,False,1,100,+100,"Monitor LG Curvo 24"", FHD, 100Hz, 5ms, USB-C, 24U421A-B",0,0,False,{},,,,,,
54594,6648757,PRIME-B760M-A LGA1700 MB,Asus,90MB1EK0-M1EAY0,105.59,314,Componentes de Sistema,Tarjetas Madre Intel,ok,False,1,50,+50,Placa Madre Intel PRIME B760M-A (s1700),0,0,False,{},,,,,,
54883,6681009,CAMARA GOPRO MAX 2,Gopro,CHDHZ-311-RW,450.16,163,Cámaras y Escáners,Cámaras de Video Digital,ok,False,1,1,1,Cámara GoPro MAX 2 360 Black,0,0,False,{},,,,,,
54777,6650362,HERO13 Black Extended Power Bundle,Gopro,CHDRB-134-RW,434.56,226,Cámaras y Escáners,Cámaras de Video Digital,ok,False,1,100,+100,Cámara Hero13 Black Extended Power Bundle,0,0,False,{},,,,,,
55026,6681010,CAMARA GOPRO LIT FRACTION,Gopro,CHDHF-132-AT,272.85,58,Cámaras y Escáners,Cámaras de Video Digital,ok,False,1,1,1,Cámara GoPro LIT HERO,0,0,False,{},,,,,,
51466,6685186,MICROFONO USB NEGRO SOLOCAST,Hp,4P5P8AA,57.79,1,Dispositivos Audio/Video,Micrófonos para PCs,ok,False,1,1,1,Micrófono Gamer HyperX SoloCast Black,0,0,False,{},,,,,,
54618,6685194,MICROFONO QUADCAST 2 NEGRO,Hp,872V1AA,117.19,20,Dispositivos Audio/Video,Micrófonos para PCs,ok,False,1,50,+50,Micrófono Gamer HyperX QuadCast 2 - Negro,0,0,False,{},,,,,,
49916,6685191,AURICULARES CON CABLE GAMING,Hp,519T1AA,44.61,8,Comunicaciones,Headsets Alámbricos VoIP,ok,False,1,30,+30,"Audífono Gamer HyperX Cloud Stinger 2, Sonido Estéreo, Conexión 3.5mm, Negro",0,0,False,{},,155129,37990,29990,37990,43191
54806,6694378,ECOTANK L4360 IMPRESORA MULTIFUNCIONAL A,Epson,C11CL41303,236.4,175,Impresoras,Multifuncionales Láser Color,ok,False,1,100,+100,Multifuncional Tinta Continua EcoTank L4360 WiFi-Direct/ Dúplex automático ,0,0,False,{},,358396,249990,204990,239990,255948
54865,6705812,PROYECTOR EPSON POWERLITE E24,Epson,V11HB51021,409.87,35,Dispositivos Audio/Video,Proyectores LCD,ok,False,1,30,+30,Proyector Powerlite E24,0,0,False,{},,360265,479990,443681,,475263
55091,6710569,22U401A MONITOR FHD 21.5 100HZ,Lg,22U401A-B.AWHQ,69.98,598,Pantallas,Monitores LCD/LED,ok,False,1,100,+100,"Monitor LG 22"" FHD, 100Hz, VA, 22U401A-B.AWHQ",0,0,False,{},,,,,,
56534,6709553,TUF GAMING B860-PLUS WIFI,Asus,90MB1JL0-M0EAY0,206.55,55,Componentes de Sistema,Tarjetas Madre Intel,ok,True,0,50,+50,Placa madre Intel TUF GAMING B860-PLUS WIFI,0,0,False,{},,277396,,234990,,251447
56379,6750456,MF120 Lite ARGB,Cooler Master,MFW-B2DN-17NPA-R1,7.13,116,Computadores Servidores y Notebooks,Componentes Terminales,ok,False,1,30,+30,Ventilador MF120 Lite ARGB,0,0,False,{},,361033,9990,7500,9990,9190
56220,6749920,IMPRESORA ECOTANK PRO L6370,Epson,C11CL43303,330.96,125,Impresoras,Multifuncionales Inkjet,ok,False,1,22,22,Multifuncional Tinta Continua EcoTank L6370 WiFi-Direct /Dúplex,0,0,False,{},,364814,359990,319990,379990,378028
53103,6751723,MOCHILA GRIS 16IN SP LITE,Kensington,K60398WW,12.94,102,Computadores Servidores y Notebooks,Bolsos y Mochilas p/Notebooks,ok,False,1,50,+50,"Mochila para Notebook Simply Portable Waterproof 16"" - Gris",0,0,False,{},,,,,,
56380,6750457,MasterLiquid Core Nex 360 White,Cooler Master,MLX-D36M-A18PA-RW,63.07,114,Componentes de Sistema,Fuentes de Poder para Gabinetes Específi,ok,False,1,16,16,Refrigeración Liquida MasterLiquid Core Nex 360 Blanco,0,0,False,{},,378743,77990,70855,,74873
56381,6750458,MasterLiquid Core Nex 360 ARGB,Cooler Master,MLX-D36M-A18PA-R1,63.06,181,Componentes de Sistema,Fuentes de Poder para Gabinetes Específi,ok,False,1,24,24,Refrigeración Liquida MasterLiquid Core Nex 360 ARGB,0,0,False,{},,386784,77990,69995,,74900
55306,6783816,Monitor Samsung Odyssey G5 32IN IPS QHD,Samsung,LS32FG500ELXZS,219.32,120,Pantallas,Monitores LCD/LED,ok,False,1,50,+50,"Monitor Gamer Samsung 32"", QHD, 180Hz, VA, 1ms, HDR10, FreeSync, Odyssey G5 LS32FG500ELXZS",0,0,False,{},,368697,269990,230390,239990,259638
55799,6779529,SMART TV LG 65IN QNED AI 4K,Lg,65QNED73ASA.AWH,522.03,86,Pantallas,TV LCD/LED,ok,False,1,2,2,"Smart TV LG 65"" QNED73ASA.AWH",0,0,False,{},,,,,,
56195,6783814,Monitor Gamer Samsung Odyssey G5 27IN QH,Samsung,LS27FG500ELXZS,176.59,149,Pantallas,Monitores LCD/LED,ok,False,1,100,+100,"Monitor Gamer Samsung 27"" QHD, 180Hz, Odyssey G5 G50F, LS27FG500ELXZS",0,0,False,{},,384137,209990,157900,199990,192723
55305,6783817,Monitor Samsung Smart M5 27IN VA FHD,Samsung,LS27FM501ELXZS,159.9,55,Pantallas,Monitores LCD/LED,ok,False,1,1,1,"Monitor Smart Samsung 27"", FHD, 60Hz , VA, 4ms, HDR, LS27FM501ELXZS",0,0,False,{},,379069,179990,178990,219990,198309
56196,6783819,Monitor Samsung Odyssey G6 27IN QHD,Samsung,LS27FG602ELXZS,356.21,50,Pantallas,Monitores LCD/LED,ok,False,1,9,9,"Monitor Gamer Samsung 27"" QHD, 350Hz, Odyssey G6 G60F, LS27FG602ELXZS",0,0,False,{},,369294,389990,389990,389990,423216
54390,6783820,Monitor Samsung S8 37IN VA 4K UHD,Samsung,LS37D800UALXZS,376.9,28,Pantallas,Monitores LCD/LED,ok,False,1,6,6,"Monitor Samsung 37"" UHD, 60Hz, ViewFinity S8",0,0,False,{},,274084,429990,404928,,431627
54579,6784290,PRIME B650EM-A WIFI//SOCKET AM5,Asus,90MB1LM0-M0EAY0,132.21,79,Componentes de Sistema,Tarjetas Madre AMD,ok,False,1,18,18,Placa Madre AMD PRIME B650EM-A WIFI (sAM5),0,0,False,{},,,,,,
56103,6804958,27IN Odyssey G5 G53F QHD 200Hz Panel IPS,Samsung,LS27FG530ELXZS,142.48,230,Pantallas,Monitores LCD/LED,ok,False,1,50,+50,"Monitor Gamer Samsung 27"", QHD, 200Hz, IPS, 1ms, HDR10, FreeSync, Odyssey G5 LS27FG530ELXZS",0,0,False,{},,367652,184290,164314,,181860
55624,6784292,PRIME H610M-K,Asus,90MB1GA0-MVAAY0,71.28,155,Componentes de Sistema,Tarjetas Madre Intel,ok,False,1,29,29,Placa Madre Intel PRIME H610M-K (s1700),0,0,False,{},,,,,,
48503,6822114,MOUSE INALAMBRICO GAMING,Hp,6N0B0AA,70.69,30,Dispositivos de Entrada,Mouse,ok,False,1,50,+50,Mouse Gamer Inalámbrico HyperX Pulsefire Haste 2 - Negro,0,0,False,{},,226714,64990,52990,64990,62839
